    1  15:51:22.665599 2412494111us tsft -63dBm signal -89dBm noise antenna 1 5785 MHz 11a ht/20 [|802.11]IP 130.211.14.80.443 > 192.168.1.12.59939: Flags [S.], seq 1744003503, ack 759666048, win 60192, options [mss 1380,sackOK,TS val 532790873 ecr 1152870899,nop,wscale 8], length 0
    2  15:51:23.221500 2413049991us tsft -89dBm noise antenna 1 5785 MHz 11a ht/20 User 0 MCS 7 LDPC FEC 80 MHz short GI IP 130.211.14.80.443 > 192.168.1.15.55708: Flags [.], ack 2770925812, win 479, options [nop,nop,TS val 1905705920 ecr 1154567312], length 0
    3  15:51:23.221579 2413049991us tsft -89dBm noise antenna 1 5785 MHz 11a ht/20 User 0 MCS 7 LDPC FEC 80 MHz short GI IP 130.211.14.80.443 > 192.168.1.15.55708: Flags [.], ack 1369, win 490, options [nop,nop,TS val 1905705935 ecr 1154567312], length 0
    4  15:51:23.221655 2413049991us tsft -59dBm signal -89dBm noise antenna 1 5785 MHz 11a ht/20 [|802.11]IP 130.211.14.80.443 > 192.168.1.15.55708: Flags [.], ack 1979, win 500, options [nop,nop,TS val 1905705935 ecr 1154567312], length 0
    5  15:51:23.263713 2413092266us tsft -47dBm signal -89dBm noise antenna 1 5785 MHz 11a ht/20 [|802.11]IP 192.168.1.15.59069 > 130.211.14.80.443: Flags [S], seq 759666047, win 65535, options [mss 1460,nop,wscale 6,nop,nop,TS val 1152871900 ecr 0,sackOK,eol], length 0
    6  15:51:23.320907 2413149431us tsft -89dBm noise antenna 1 5785 MHz 11a ht/20 User 0 MCS 7 LDPC FEC 80 MHz short GI IP 130.211.14.80.443 > 192.168.1.15.55708: Flags [P.], seq 0:72, ack 1979, win 500, options [nop,nop,TS val 1905706099 ecr 1154567312], length 72
    7  15:51:23.321015 2413149431us tsft -89dBm noise antenna 1 5785 MHz 11a ht/20 User 0 MCS 7 LDPC FEC 80 MHz short GI IP 130.211.14.80.443 > 192.168.1.15.55708: Flags [P.], seq 72:1110, ack 1979, win 500, options [nop,nop,TS val 1905706099 ecr 1154567312], length 1038
    8  15:51:23.321091 2413149431us tsft -62dBm signal -89dBm noise antenna 1 5785 MHz 11a ht/20 [|802.11]IP 130.211.14.80.443 > 192.168.1.15.55708: Flags [P.], seq 1110:1156, ack 1979, win 500, options [nop,nop,TS val 1905706101 ecr 1154567312], length 46
    9  15:51:23.380299 2413208778us tsft -63dBm signal -89dBm noise antenna 1 5785 MHz 11a ht/20 [|802.11]IP 130.211.14.80.443 > 192.168.1.12.59939: Flags [S.], seq 1744003503, ack 759666048, win 60192, options [mss 1380,sackOK,TS val 532791564 ecr 1152870899,nop,wscale 8], length 0
   10  15:51:23.382775 2413211339us tsft -48dBm signal -89dBm noise antenna 1 5785 MHz 11a ht/20 [|802.11]IP 192.168.1.12.59939 > 130.211.14.80.443: Flags [R], seq 759666048, win 0, length 0
   11  15:51:23.423452 2413252002us tsft -60dBm signal -89dBm noise antenna 1 5785 MHz 11a ht/20 [|802.11]IP 130.211.14.80.443 > 192.168.1.15.55708: Flags [.], ack 2025, win 500, options [nop,nop,TS val 1905706184 ecr 1154567567], length 0
   12  15:51:24.288633 2414117170us tsft -47dBm signal -89dBm noise antenna 1 5785 MHz 11a ht/20 [|802.11]IP 192.168.1.15.59069 > 130.211.14.80.443: Flags [S], seq 759666047, win 65535, options [mss 1460,nop,wscale 6,nop,nop,TS val 1152872900 ecr 0,sackOK,eol], length 0
   13  15:51:25.379407 2415207926us tsft -93dBm noise antenna 1 5785 MHz 11a ht/20 User 0 MCS 5 LDPC FEC 80 MHz long GI IP 192.168.1.14.63881 > 130.211.14.80.443: Flags [P.], seq 1141669557:1141669623, ack 3072532930, win 4096, options [nop,nop,TS val 2250018033 ecr 1736374610], length 66
   14  15:51:25.379514 2415207926us tsft -93dBm noise antenna 1 5785 MHz 11a ht/20 User 0 MCS 5 LDPC FEC 80 MHz long GI IP 192.168.1.14.63881 > 130.211.14.80.443: Flags [.], seq 66:1434, ack 1, win 4096, options [nop,nop,TS val 2250018033 ecr 1736374610], length 1368
   15  15:51:25.379589 2415207926us tsft -37dBm signal -93dBm noise antenna 1 5785 MHz 11a ht/20 [|802.11]IP 192.168.1.14.63881 > 130.211.14.80.443: Flags [P.], seq 1434:1716, ack 1, win 4096, options [nop,nop,TS val 2250018033 ecr 1736374610], length 282
   16  15:51:25.419561 2415248062us tsft -55dBm signal -93dBm noise antenna 1 5785 MHz 11a ht/20 [|802.11]IP 130.211.14.80.443 > 192.168.1.14.63881: Flags [.], ack 66, win 1099, options [nop,nop,TS val 1736377650 ecr 2250018033], length 0
   17  15:51:25.426561 2415254857us tsft -93dBm noise antenna 1 5785 MHz 11a ht/20 User 0 MCS 3 LDPC FEC 80 MHz long GI IP 130.211.14.80.443 > 192.168.1.14.63881: Flags [.], ack 1434, win 1094, options [nop,nop,TS val 1736377659 ecr 2250018033], length 0
   18  15:51:25.426638 2415254857us tsft -55dBm signal -93dBm noise antenna 1 5785 MHz 11a ht/20 [|802.11]IP 130.211.14.80.443 > 192.168.1.14.63881: Flags [.], ack 1716, win 1095, options [nop,nop,TS val 1736377659 ecr 2250018033], length 0
   19  15:51:25.428256 2415256770us tsft -61dBm signal -93dBm noise antenna 1 5785 MHz 11a ht/20 [|802.11]IP 130.211.14.80.443 > 192.168.1.12.59939: Flags [S.], seq 1744003503, ack 759666048, win 60192, options [mss 1380,sackOK,TS val 532793596 ecr 1152870899,nop,wscale 8], length 0
   20  15:51:25.429537 2415258011us tsft -56dBm signal -93dBm noise antenna 1 5785 MHz 11a ht/20 [|802.11]IP 192.168.1.12.59939 > 130.211.14.80.443: Flags [R], seq 759666048, win 0, length 0
   21  15:51:25.470376 2415298871us tsft -93dBm noise antenna 1 5785 MHz 11a ht/20 User 0 MCS 7 LDPC FEC 80 MHz short GI IP 192.168.1.11.50938 > 172.217.160.110.443: Flags [P.], seq 1066409276:1066409307, ack 3511158581, win 1024, options [nop,nop,TS val 1662834123 ecr 1356676692], length 31
   22  15:51:25.470474 2415298871us tsft -48dBm signal -93dBm noise antenna 1 5785 MHz 11a ht/20 [|802.11]IP 192.168.1.11.50938 > 172.217.160.110.443: Flags [F.], seq 31, ack 1, win 1024, options [nop,nop,TS val 1662834124 ecr 1356676692], length 0
   23  15:51:25.621579 2415450139us tsft -93dBm noise antenna 1 5785 MHz 11a ht/20 User 0 MCS 3 LDPC FEC 80 MHz long GI IP 130.211.14.80.443 > 192.168.1.14.63881: Flags [P.], seq 1:73, ack 1716, win 1099, options [nop,nop,TS val 1736377823 ecr 2250018033], length 72
   24  15:51:25.621657 2415450139us tsft -93dBm noise antenna 1 5785 MHz 11a ht/20 User 0 MCS 3 LDPC FEC 80 MHz long GI IP 130.211.14.80.443 > 192.168.1.14.63881: Flags [P.], seq 73:1093, ack 1716, win 1099, options [nop,nop,TS val 1736377823 ecr 2250018033], length 1020
   25  15:51:25.621728 2415450139us tsft -55dBm signal -93dBm noise antenna 1 5785 MHz 11a ht/20 [|802.11]IP 130.211.14.80.443 > 192.168.1.14.63881: Flags [P.], seq 1093:1139, ack 1716, win 1099, options [nop,nop,TS val 1736377823 ecr 2250018033], length 46
   26  15:51:25.624415 2415452927us tsft -93dBm noise antenna 1 5785 MHz 11a ht/20 User 0 MCS 5 LDPC FEC 80 MHz long GI IP 192.168.1.14.63881 > 130.211.14.80.443: Flags [.], ack 73, win 4093, options [nop,nop,TS val 2250018276 ecr 1736377823], length 0
   27  15:51:25.624490 2415452927us tsft -93dBm noise antenna 1 5785 MHz 11a ht/20 User 0 MCS 5 LDPC FEC 80 MHz long GI IP 192.168.1.14.63881 > 130.211.14.80.443: Flags [.], ack 1093, win 4061, options [nop,nop,TS val 2250018276 ecr 1736377823], length 0
   28  15:51:25.624563 2415452927us tsft -93dBm noise antenna 1 5785 MHz 11a ht/20 User 0 MCS 5 LDPC FEC 80 MHz long GI IP 192.168.1.14.63881 > 130.211.14.80.443: Flags [.], ack 1139, win 4060, options [nop,nop,TS val 2250018276 ecr 1736377823], length 0
   29  15:51:25.624635 2415452927us tsft -45dBm signal -93dBm noise antenna 1 5785 MHz 11a ht/20 [|802.11]IP 192.168.1.14.63881 > 130.211.14.80.443: Flags [P.], seq 1716:1762, ack 1139, win 4096, options [nop,nop,TS val 2250018276 ecr 1736377823], length 46
   30  15:51:25.676440 2415504965us tsft -54dBm signal -93dBm noise antenna 1 5785 MHz 11a ht/20 [|802.11]IP 130.211.14.80.443 > 192.168.1.14.63881: Flags [.], ack 1762, win 1099, options [nop,nop,TS val 1736377889 ecr 2250018276], length 0
   31  15:51:25.835959 2415664355us tsft -45dBm signal -93dBm noise antenna 1 5785 MHz 11a ht/20 [|802.11]IP 192.168.1.14.64052 > 17.167.194.149.443: Flags [S], seq 2472463363, win 65535, options [mss 1460,nop,wscale 5,nop,nop,TS val 2250018486 ecr 0,sackOK,eol], length 0
   32  15:51:25.836240 2415664572us tsft -45dBm signal -93dBm noise antenna 1 5785 MHz 11a ht/20 [|802.11]IP 192.168.1.14.64052 > 17.167.194.149.443: Flags [S], seq 2472463363, win 65535, options [mss 1460,nop,wscale 5,nop,nop,TS val 2250018486 ecr 0,sackOK,eol], length 0
   33  15:51:25.836465 2415664787us tsft -45dBm signal -93dBm noise antenna 1 5785 MHz 11a ht/20 [|802.11]IP 192.168.1.14.64052 > 17.167.194.149.443: Flags [S], seq 2472463363, win 65535, options [mss 1460,nop,wscale 5,nop,nop,TS val 2250018486 ecr 0,sackOK,eol], length 0
   34  15:51:25.982491 2415810969us tsft -93dBm noise antenna 1 5785 MHz 11a ht/20 User 0 MCS 4 LDPC FEC 80 MHz long GI IP 192.168.1.15.55708 > 130.211.14.80.443: Flags [P.], seq 2025:2090, ack 1156, win 1024, options [nop,nop,TS val 1154570202 ecr 1905706184], length 65
   35  15:51:25.982567 2415810969us tsft -93dBm noise antenna 1 5785 MHz 11a ht/20 User 0 MCS 4 LDPC FEC 80 MHz long GI IP 192.168.1.15.55708 > 130.211.14.80.443: Flags [.], seq 2090:3458, ack 1156, win 1024, options [nop,nop,TS val 1154570202 ecr 1905706184], length 1368
   36  15:51:25.982684 2415810969us tsft -38dBm signal -93dBm noise antenna 1 5785 MHz 11a ht/20 [|802.11]IP 192.168.1.15.55708 > 130.211.14.80.443: Flags [P.], seq 3458:3772, ack 1156, win 1024, options [nop,nop,TS val 1154570202 ecr 1905706184], length 314
   37  15:51:26.234985 2416063506us tsft bad-fcs -60dBm signal -93dBm noise antenna 1 5785 MHz 11a ht/20 [|802.11]IP 130.211.14.80.443 > 192.168.1.15.55708: Flags [P.], seq 1228:2482, ack 3772, win 522, options [nop,nop,TS val 1905708989 ecr 1154570202], length 1254
   38  15:51:26.235183 2416063632us tsft -60dBm signal -93dBm noise antenna 1 5785 MHz 11a ht/20 [|802.11]IP 130.211.14.80.443 > 192.168.1.15.55708: Flags [P.], seq 2482:2528, ack 3772, win 522, options [nop,nop,TS val 1905708992 ecr 1154570202], length 46
   39  15:51:26.237859 2416066308us tsft -93dBm noise antenna 1 5785 MHz 11a ht/20 User 0 MCS 7 LDPC FEC 80 MHz short GI IP 192.168.1.15.55708 > 130.211.14.80.443: Flags [.], ack 2482, win 1014, options [nop,nop,TS val 1154570476 ecr 1905708989], length 0
   40  15:51:26.237940 2416066308us tsft -93dBm noise antenna 1 5785 MHz 11a ht/20 User 0 MCS 7 LDPC FEC 80 MHz short GI IP 192.168.1.15.55708 > 130.211.14.80.443: Flags [.], ack 2528, win 1013, options [nop,nop,TS val 1154570476 ecr 1905708992], length 0
   41  15:51:26.238015 2416066308us tsft -41dBm signal -93dBm noise antenna 1 5785 MHz 11a ht/20 [|802.11]IP 192.168.1.15.55708 > 130.211.14.80.443: Flags [P.], seq 3772:3818, ack 2528, win 1024, options [nop,nop,TS val 1154570477 ecr 1905708992], length 46
   42  15:51:26.290391 2416118892us tsft -41dBm signal -93dBm noise antenna 1 5785 MHz 11a ht/20 [|802.11]IP 192.168.1.15.59069 > 130.211.14.80.443: Flags [S], seq 759666047, win 65535, options [mss 1460,nop,wscale 6,nop,nop,TS val 1152874900 ecr 0,sackOK,eol], length 0
   43  15:51:26.336317 2416164810us tsft -56dBm signal -93dBm noise antenna 1 5785 MHz 11a ht/20 [|802.11]IP 192.168.1.12.51091 > 130.211.14.80.443: Flags [S], seq 3642665676, win 65535, options [mss 1460,nop,wscale 6,nop,nop,TS val 1201715014 ecr 0,sackOK,eol], length 0
   44  15:51:26.336709 2416165325us tsft -57dBm signal -93dBm noise antenna 1 5785 MHz 11a ht/20 [|802.11]IP 130.211.14.80.443 > 192.168.1.12.59939: Flags [S.], seq 1083788815, ack 759666048, win 60192, options [mss 1380,sackOK,TS val 1381011004 ecr 1152874900,nop,wscale 8], length 0
   45  15:51:26.391997 2416220492us tsft -50dBm signal -93dBm noise antenna 1 5785 MHz 11a ht/20 [|802.11]IP 192.168.1.14.64053 > 17.167.192.128.443: Flags [S], seq 986619786, win 65535, options [mss 1460,nop,wscale 5,nop,nop,TS val 2250019038 ecr 0,sackOK,eol], length 0
   46  15:51:26.393248 2416221733us tsft -59dBm signal -93dBm noise antenna 1 5785 MHz 11a ht/20 [|802.11]IP 130.211.14.80.443 > 192.168.1.12.59938: Flags [S.], seq 977445088, ack 3642665677, win 60192, options [mss 1380,sackOK,TS val 4293331486 ecr 1201715014,nop,wscale 8], length 0
   47  15:51:26.393484 2416221842us tsft -53dBm signal -93dBm noise antenna 1 5785 MHz 11a ht/20 [|802.11]IP 17.167.194.149.443 > 192.168.1.14.64052: Flags [S.], seq 3822681737, ack 2472463364, win 8190, options [mss 1460,nop,wscale 7,nop,nop,sackOK], length 0
   48  15:51:26.395651 2416224214us tsft -49dBm signal -93dBm noise antenna 1 5785 MHz 11a ht/20 [|802.11]IP 192.168.1.14.64052 > 17.167.194.149.443: Flags [.], ack 1, win 8192, length 0
   49  15:51:26.395997 2416224486us tsft -54dBm signal -93dBm noise antenna 1 5785 MHz 11a ht/20 [|802.11]IP 192.168.1.12.59938 > 130.211.14.80.443: Flags [R], seq 3642665677, win 0, length 0
   50  15:51:26.403639 2416232064us tsft -48dBm signal -93dBm noise antenna 1 5785 MHz 11a ht/20 [|802.11]IP 192.168.1.14.64052 > 17.167.194.149.443: Flags [P.], seq 1:244, ack 1, win 8192, length 243
   51  15:51:26.665154 2416493632us tsft -60dBm signal -93dBm noise antenna 1 5785 MHz 11a ht/20 [|802.11]IP 130.211.14.80.443 > 192.168.1.12.59939: Flags [S.], seq 1083788815, ack 759666048, win 60192, options [mss 1380,sackOK,TS val 1381011304 ecr 1152874900,nop,wscale 8], length 0
   52  15:51:26.701289 2416529739us tsft -45dBm signal -93dBm noise antenna 1 5785 MHz 11a ht/20 [|802.11]IP 192.168.1.12.59939 > 130.211.14.80.443: Flags [R], seq 759666048, win 0, length 0
   53  15:51:26.757643 2416585983us tsft -61dBm signal -93dBm noise antenna 1 5785 MHz 11a ht/20 [|802.11]IP 130.211.14.80.443 > 192.168.1.12.59938: Flags [S.], seq 977445088, ack 3642665677, win 60192, options [mss 1380,sackOK,TS val 4293331786 ecr 1201715014,nop,wscale 8], length 0
   54  15:51:26.759767 2416588198us tsft -47dBm signal -93dBm noise antenna 1 5785 MHz 11a ht/20 [|802.11]IP 192.168.1.12.59938 > 130.211.14.80.443: Flags [R], seq 3642665677, win 0, length 0
   55  15:51:26.760258 2416588801us tsft -93dBm noise antenna 1 5785 MHz 11a ht/20 User 0 MCS 4 LDPC FEC 80 MHz long GI IP 17.167.192.128.443 > 192.168.1.14.64053: Flags [S.], seq 1546075826, ack 986619787, win 8190, options [mss 1460,nop,wscale 7,nop,nop,sackOK], length 0
   56  15:51:26.760333 2416588801us tsft -93dBm noise antenna 1 5785 MHz 11a ht/20 User 0 MCS 4 LDPC FEC 80 MHz long GI IP 17.167.194.149.443 > 192.168.1.14.64052: Flags [.], ack 244, win 256, length 0
   57  15:51:26.760473 2416588801us tsft -93dBm noise antenna 1 5785 MHz 11a ht/20 User 0 MCS 4 LDPC FEC 80 MHz long GI IP 17.167.194.149.443 > 192.168.1.14.64052: Flags [.], seq 1:1461, ack 244, win 256, length 1460
   58  15:51:26.760546 2416588801us tsft -56dBm signal -93dBm noise antenna 1 5785 MHz 11a ht/20 [|802.11]IP 17.167.194.149.443 > 192.168.1.14.64052: Flags [P.], seq 1461:2843, ack 244, win 256, length 1382
   59  15:51:26.762653 2416591154us tsft -53dBm signal -93dBm noise antenna 1 5785 MHz 11a ht/20 [|802.11]IP 192.168.1.14.64053 > 17.167.192.128.443: Flags [R], seq 986619787, win 0, length 0
   60  15:51:26.762925 2416591370us tsft -52dBm signal -93dBm noise antenna 1 5785 MHz 11a ht/20 [|802.11]IP 192.168.1.14.64053 > 17.167.192.128.443: Flags [R], seq 986619787, win 0, length 0
   61  15:51:26.763226 2416591585us tsft -52dBm signal -93dBm noise antenna 1 5785 MHz 11a ht/20 [|802.11]IP 192.168.1.14.64053 > 17.167.192.128.443: Flags [R], seq 986619787, win 0, length 0
   62  15:51:26.763446 2416591801us tsft -52dBm signal -93dBm noise antenna 1 5785 MHz 11a ht/20 [|802.11]IP 192.168.1.14.64053 > 17.167.192.128.443: Flags [R], seq 986619787, win 0, length 0
   63  15:51:26.763797 2416592134us tsft -93dBm noise antenna 1 5785 MHz 11a ht/20 User 0 MCS 4 LDPC FEC 80 MHz long GI IP 17.167.194.149.443 > 192.168.1.14.64052: Flags [.], seq 1:1461, ack 244, win 256, length 1460
   64  15:51:26.763874 2416592134us tsft -55dBm signal -93dBm noise antenna 1 5785 MHz 11a ht/20 [|802.11]IP 17.167.194.149.443 > 192.168.1.14.64052: Flags [P.], seq 1461:2843, ack 244, win 256, length 1382
   65  15:51:26.771283 2416599794us tsft -93dBm noise antenna 1 5785 MHz 11a ht/20 User 0 MCS 4 LDPC FEC 80 MHz long GI IP 17.167.194.149.443 > 192.168.1.14.64052: Flags [.], seq 1:1461, ack 244, win 256, length 1460
   66  15:51:26.771430 2416599794us tsft -56dBm signal -93dBm noise antenna 1 5785 MHz 11a ht/20 [|802.11]IP 17.167.194.149.443 > 192.168.1.14.64052: Flags [P.], seq 1461:2843, ack 244, win 256, length 1382
   67  15:51:26.807947 2416636455us tsft -93dBm noise antenna 1 5785 MHz 11a ht/20 User 0 MCS 4 LDPC FEC 80 MHz long GI IP 17.167.194.149.443 > 192.168.1.14.64052: Flags [.], seq 1:1461, ack 244, win 256, length 1460
   68  15:51:26.808091 2416636455us tsft bad-fcs -55dBm signal -93dBm noise antenna 1 5785 MHz 11a ht/20 [|802.11]IP 17.167.194.149.443 > 192.168.1.14.64052: Flags [P.], seq 1461:2843, ack 244, win 256, length 1382
   69  15:51:26.814940 2416643454us tsft -56dBm signal -93dBm noise antenna 1 5785 MHz 11a ht/20 [|802.11]IP 17.167.194.149.443 > 192.168.1.14.64052: Flags [P.], seq 1461:2843, ack 244, win 256, length 1382
   70  15:51:26.818188 2416646567us tsft -52dBm signal -93dBm noise antenna 1 5785 MHz 11a ht/20 [|802.11]IP 192.168.1.14.64052 > 17.167.194.149.443: Flags [.], ack 2843, win 8148, length 0
   71  15:51:26.848783 2416677336us tsft -56dBm signal -93dBm noise antenna 1 5785 MHz 11a ht/20 [|802.11]IP 17.167.194.149.443 > 192.168.1.14.64052: Flags [P.], seq 1461:2843, ack 244, win 256, length 1382
   72  15:51:26.851693 2416680163us tsft -53dBm signal -93dBm noise antenna 1 5785 MHz 11a ht/20 [|802.11]IP 192.168.1.14.64052 > 17.167.194.149.443: Flags [.], ack 2843, win 8192, options [nop,nop,sack 1 {1461:2843}], length 0
   73  15:51:26.852473 2416680963us tsft -53dBm signal -93dBm noise antenna 1 5785 MHz 11a ht/20 [|802.11]IP 192.168.1.14.64052 > 17.167.194.149.443: Flags [P.], seq 244:319, ack 2843, win 8192, length 75
   74  15:51:26.853041 2416681636us tsft -93dBm noise antenna 1 5785 MHz 11a ht/20 User 0 MCS 5 LDPC FEC 80 MHz long GI IP 192.168.1.14.64052 > 17.167.194.149.443: Flags [P.], seq 319:325, ack 2843, win 8192, length 6
   75  15:51:26.853117 2416681636us tsft -53dBm signal -93dBm noise antenna 1 5785 MHz 11a ht/20 [|802.11]IP 192.168.1.14.64052 > 17.167.194.149.443: Flags [P.], seq 325:370, ack 2843, win 8192, length 45
   76  15:51:26.920446 2416748868us tsft -57dBm signal -93dBm noise antenna 1 5785 MHz 11a ht/20 [|802.11]IP 17.167.194.149.443 > 192.168.1.14.64052: Flags [.], seq 1:1461, ack 244, win 256, length 1460
   77  15:51:26.922490 2416750975us tsft -56dBm signal -93dBm noise antenna 1 5785 MHz 11a ht/20 [|802.11]IP 192.168.1.14.64052 > 17.167.194.149.443: Flags [.], ack 2843, win 8192, options [nop,nop,sack 1 {1:1461}], length 0
   78  15:51:27.160731 2416989144us tsft -57dBm signal -93dBm noise antenna 1 5785 MHz 11a ht/20 [|802.11]IP 17.167.194.149.443 > 192.168.1.14.64052: Flags [.], ack 370, win 256, length 0
   79  15:51:27.162223 2416990715us tsft -93dBm noise antenna 1 5785 MHz 11a ht/20 User 0 MCS 3 LDPC FEC 80 MHz long GI IP 17.167.194.149.443 > 192.168.1.14.64052: Flags [.], ack 370, win 256, length 0
   80  15:51:27.162333 2416990715us tsft bad-fcs -57dBm signal -93dBm noise antenna 1 5785 MHz 11a ht/20 [|802.11]IP 17.167.194.149.443 > 192.168.1.14.64052: Flags [P.], seq 2843:2894, ack 370, win 256, length 51
   81  15:51:27.164074 2416992554us tsft bad-fcs -57dBm signal -93dBm noise antenna 1 5785 MHz 11a ht/20 [|802.11]IP 17.167.194.149.443 > 192.168.1.14.64052: Flags [P.], seq 2843:2894, ack 370, win 256, length 51
   82  15:51:27.167178 2416995582us tsft -93dBm noise antenna 1 5785 MHz 11a ht/20 User 0 MCS 3 LDPC FEC 80 MHz long GI IP 17.167.194.149.443 > 192.168.1.14.64052: Flags [.], ack 370, win 256, length 0
   83  15:51:27.167252 2416995582us tsft bad-fcs -57dBm signal -93dBm noise antenna 1 5785 MHz 11a ht/20 [|802.11]IP 17.167.194.149.443 > 192.168.1.14.64052: Flags [P.], seq 2843:2894, ack 370, win 256, length 51
   84  15:51:27.172062 2417000508us tsft -93dBm noise antenna 1 5785 MHz 11a ht/20 User 0 MCS 4 LDPC FEC 80 MHz long GI IP 17.167.194.149.443 > 192.168.1.14.64052: Flags [.], ack 370, win 256, length 0
   85  15:51:27.172137 2417000508us tsft -58dBm signal -93dBm noise antenna 1 5785 MHz 11a ht/20 [|802.11]IP 17.167.194.149.443 > 192.168.1.14.64052: Flags [P.], seq 2843:2894, ack 370, win 256, length 51
   86  15:51:27.212388 2417040868us tsft -93dBm noise antenna 1 5785 MHz 11a ht/20 User 0 MCS 3 LDPC FEC 80 MHz long GI IP 192.168.1.14.63881 > 130.211.14.80.443: Flags [P.], seq 1762:1828, ack 1139, win 4096, options [nop,nop,TS val 2250019845 ecr 1736377889], length 66
   87  15:51:27.212484 2417040868us tsft -93dBm noise antenna 1 5785 MHz 11a ht/20 User 0 MCS 3 LDPC FEC 80 MHz long GI IP 192.168.1.14.63881 > 130.211.14.80.443: Flags [.], seq 1828:3196, ack 1139, win 4096, options [nop,nop,TS val 2250019845 ecr 1736377889], length 1368
   88  15:51:27.212561 2417040868us tsft -55dBm signal -93dBm noise antenna 1 5785 MHz 11a ht/20 [|802.11]IP 192.168.1.14.63881 > 130.211.14.80.443: Flags [P.], seq 3196:3606, ack 1139, win 4096, options [nop,nop,TS val 2250019845 ecr 1736377889], length 410
   89  15:51:27.261548 2417090036us tsft -59dBm signal -93dBm noise antenna 1 5785 MHz 11a ht/20 [|802.11]IP 192.168.1.14.64052 > 17.167.194.149.443: Flags [.], ack 2894, win 8190, length 0
   90  15:51:27.262157 2417090478us tsft -59dBm signal -93dBm noise antenna 1 5785 MHz 11a ht/20 [|802.11]IP 192.168.1.14.64052 > 17.167.194.149.443: Flags [.], ack 2894, win 8190, length 0
   91  15:51:27.270505 2417098743us tsft -93dBm noise antenna 1 5785 MHz 11a ht/20 User 0 MCS 3 LDPC FEC 80 MHz long GI IP 192.168.1.14.64052 > 17.167.194.149.443: Flags [P.], seq 370:673, ack 2894, win 8192, length 303
   92  15:51:27.270583 2417098743us tsft -58dBm signal -93dBm noise antenna 1 5785 MHz 11a ht/20 [|802.11]IP 192.168.1.14.64052 > 17.167.194.149.443: Flags [P.], seq 673:778, ack 2894, win 8192, length 105
   93  15:51:27.271144 2417099220us tsft -39dBm signal -93dBm noise antenna 1 5785 MHz 11a ht/20 [|802.11]IP 192.168.1.15.59069 > 130.211.14.80.443: Flags [S], seq 759666047, win 65535, options [mss 1460,nop,wscale 6,nop,nop,TS val 1152875901 ecr 0,sackOK,eol], length 0
   94  15:51:27.318215 2417146685us tsft -53dBm signal -93dBm noise antenna 1 5785 MHz 11a ht/20 [|802.11]IP 130.211.14.80.443 > 192.168.1.14.63881: Flags [.], ack 1828, win 1099, options [nop,nop,TS val 1736379549 ecr 2250019845], length 0
   95  15:51:27.320368 2417148886us tsft -54dBm signal -93dBm noise antenna 1 5785 MHz 11a ht/20 [|802.11]IP 130.211.14.80.443 > 192.168.1.14.63881: Flags [.], ack 1828, win 1099, options [nop,nop,TS val 1736379549 ecr 2250019845], length 0
   96  15:51:27.325476 2417153959us tsft -54dBm signal -93dBm noise antenna 1 5785 MHz 11a ht/20 [|802.11]IP 17.167.194.149.443 > 192.168.1.14.64052: Flags [P.], seq 2843:2894, ack 370, win 256, length 51
   97  15:51:27.327834 2417156252us tsft -61dBm signal -93dBm noise antenna 1 5785 MHz 11a ht/20 [|802.11]IP 192.168.1.14.64052 > 17.167.194.149.443: Flags [.], ack 2894, win 8192, options [nop,nop,sack 1 {2843:2894}], length 0
   98  15:51:27.417718 2417246224us tsft -54dBm signal -93dBm noise antenna 1 5785 MHz 11a ht/20 [|802.11]IP 130.211.14.80.443 > 192.168.1.14.63881: Flags [.], ack 3196, win 1094, options [nop,nop,TS val 1736379616 ecr 2250019845], length 0
   99  15:51:27.483078 2417311408us tsft -55dBm signal -93dBm noise antenna 1 5785 MHz 11a ht/20 [|802.11]IP 130.211.14.80.443 > 192.168.1.14.63881: Flags [.], ack 3606, win 1095, options [nop,nop,TS val 1736379671 ecr 2250019845], length 0
  100  15:51:27.571150 2417399614us tsft -93dBm noise antenna 1 5785 MHz 11a ht/20 User 0 MCS 6 LDPC FEC 80 MHz short GI IP 192.168.1.11.50940 > 172.217.160.110.443: Flags [P.], seq 1584331899:1584331930, ack 147062827, win 1024, options [nop,nop,TS val 1662836219 ecr 2385328700], length 31
  101  15:51:27.571224 2417399614us tsft -48dBm signal -93dBm noise antenna 1 5785 MHz 11a ht/20 [|802.11]IP 192.168.1.11.50940 > 172.217.160.110.443: Flags [F.], seq 31, ack 1, win 1024, options [nop,nop,TS val 1662836219 ecr 2385328700], length 0
  102  15:51:27.669651 2417498152us tsft -93dBm noise antenna 1 5785 MHz 11a ht/20 User 0 MCS 4 LDPC FEC 80 MHz long GI IP 17.167.194.149.443 > 192.168.1.14.64052: Flags [.], ack 778, win 256, length 0
  103  15:51:27.669759 2417498152us tsft -57dBm signal -93dBm noise antenna 1 5785 MHz 11a ht/20 [|802.11]IP 17.167.194.149.443 > 192.168.1.14.64052: Flags [P.], seq 2894:3130, ack 778, win 256, length 236
  104  15:51:27.671826 2417500299us tsft -59dBm signal -93dBm noise antenna 1 5785 MHz 11a ht/20 [|802.11]IP 192.168.1.14.64052 > 17.167.194.149.443: Flags [.], ack 3130, win 8184, length 0
  105  15:51:27.672106 2417500525us tsft -59dBm signal -93dBm noise antenna 1 5785 MHz 11a ht/20 [|802.11]IP 192.168.1.14.64052 > 17.167.194.149.443: Flags [.], ack 3130, win 8184, length 0
  106  15:51:27.676793 2417505235us tsft -59dBm signal -93dBm noise antenna 1 5785 MHz 11a ht/20 [|802.11]IP 192.168.1.14.64052 > 17.167.194.149.443: Flags [F.], seq 778, ack 3130, win 8192, length 0
  107  15:51:27.828031 2417656406us tsft -54dBm signal -93dBm noise antenna 1 5785 MHz 11a ht/20 [|802.11]IP 130.211.14.80.443 > 192.168.1.14.63881: Flags [P.], seq 1139:1211, ack 3606, win 1099, options [nop,nop,TS val 1736380030 ecr 2250019845], length 72
  108  15:51:27.830284 2417658640us tsft -61dBm signal -93dBm noise antenna 1 5785 MHz 11a ht/20 [|802.11]IP 192.168.1.14.63881 > 130.211.14.80.443: Flags [.], ack 1211, win 4093, options [nop,nop,TS val 2250020468 ecr 1736380030], length 0
  109  15:51:27.830510 2417658884us tsft -61dBm signal -93dBm noise antenna 1 5785 MHz 11a ht/20 [|802.11]IP 192.168.1.14.63881 > 130.211.14.80.443: Flags [.], ack 1211, win 4093, options [nop,nop,TS val 2250020468 ecr 1736380030], length 0
  110  15:51:27.877718 2417706117us tsft bad-fcs -52dBm signal -93dBm noise antenna 1 5785 MHz 11a ht/20 [|802.11]IP 130.211.14.80.443 > 192.168.1.14.63881: Flags [P.], seq 1211:2629, ack 3606, win 1099, options [nop,nop,TS val 1736380030 ecr 2250019845], length 1418
  111  15:51:27.882006 2417710512us tsft -51dBm signal -93dBm noise antenna 1 5785 MHz 11a ht/20 [|802.11]IP 130.211.14.80.443 > 192.168.1.14.63881: Flags [P.], seq 1211:2629, ack 3606, win 1099, options [nop,nop,TS val 1736380030 ecr 2250019845], length 1418
  112  15:51:27.888816 2417717240us tsft -54dBm signal -93dBm noise antenna 1 5785 MHz 11a ht/20 [|802.11]IP 130.211.14.80.443 > 192.168.1.14.63881: Flags [P.], seq 1211:2629, ack 3606, win 1099, options [nop,nop,TS val 1736380030 ecr 2250019845], length 1418
  113  15:51:27.891184 2417719599us tsft -59dBm signal -93dBm noise antenna 1 5785 MHz 11a ht/20 [|802.11]IP 192.168.1.14.63881 > 130.211.14.80.443: Flags [.], ack 2629, win 4051, options [nop,nop,TS val 2250020527 ecr 1736380030], length 0
  114  15:51:27.929260 2417757755us tsft bad-fcs -93dBm noise antenna 1 5785 MHz 11a ht/20 User 0 MCS 2 LDPC FEC 80 MHz long GI IP 130.211.14.80.443 > 192.168.1.14.63881: Flags [.], seq 2629:4047, ack 3606, win 1099, options [nop,nop,TS val 1736380031 ecr 2250019845], length 1418
  115  15:51:27.929335 2417757755us tsft bad-fcs -48dBm signal -93dBm noise antenna 1 5785 MHz 11a ht/20 [|802.11]IP 130.211.14.80.443 > 192.168.1.14.63881: Flags [P.], seq 5412:6830, ack 3606, win 1099, options [nop,nop,TS val 1736380033 ecr 2250019845], length 1418
  116  15:51:27.931089 2417759524us tsft -93dBm noise antenna 1 5785 MHz 11a ht/20 User 0 MCS 2 LDPC FEC 80 MHz long GI IP 130.211.14.80.443 > 192.168.1.14.63881: Flags [.], seq 2629:4047, ack 3606, win 1099, options [nop,nop,TS val 1736380031 ecr 2250019845], length 1418
  117  15:51:27.931208 2417759524us tsft -93dBm noise antenna 1 5785 MHz 11a ht/20 User 0 MCS 2 LDPC FEC 80 MHz long GI IP 130.211.14.80.443 > 192.168.1.14.63881: Flags [P.], seq 4047:5412, ack 3606, win 1099, options [nop,nop,TS val 1736380031 ecr 2250019845], length 1365
  118  15:51:27.931287 2417759524us tsft -49dBm signal -93dBm noise antenna 1 5785 MHz 11a ht/20 [|802.11]IP 130.211.14.80.443 > 192.168.1.14.63881: Flags [P.], seq 5412:6830, ack 3606, win 1099, options [nop,nop,TS val 1736380033 ecr 2250019845], length 1418
  119  15:51:27.934370 2417762788us tsft -93dBm noise antenna 1 5785 MHz 11a ht/20 User 0 MCS 5 LDPC FEC 80 MHz long GI IP 192.168.1.14.63881 > 130.211.14.80.443: Flags [.], ack 5412, win 4009, options [nop,nop,TS val 2250020569 ecr 1736380031], length 0
  120  15:51:27.934446 2417762788us tsft -93dBm noise antenna 1 5785 MHz 11a ht/20 User 0 MCS 5 LDPC FEC 80 MHz long GI IP 192.168.1.14.63881 > 130.211.14.80.443: Flags [.], ack 5412, win 4096, options [nop,nop,TS val 2250020569 ecr 1736380031], length 0
  121  15:51:27.934519 2417762788us tsft -61dBm signal -93dBm noise antenna 1 5785 MHz 11a ht/20 [|802.11]IP 192.168.1.14.63881 > 130.211.14.80.443: Flags [.], ack 6830, win 4051, options [nop,nop,TS val 2250020569 ecr 1736380033], length 0
  122  15:51:27.998881 2417827273us tsft bad-fcs -48dBm signal -93dBm noise antenna 1 5785 MHz 11a ht/20 [|802.11]e4:18:6b:fc:70:9b > 9c:f4:8e:0e:25:b4 SNAP, oui Unknown (0x000080), pid Unknown (0x0800), length 1470: 
	0x0000:  aaaa 0300 0080 0800 4560 05be 2fb6 0000  ........E`../...
	0x0010:  7806 ba4e 82d3 0e50 c0a8 010e 01bb f989  x..N...P........
	0x0020:  a723 3c6f 440c 8ccb 8010 045b 153b 0000  .#<oD......[.;..
	0x0030:  0101 180b 677f 0e81 861c 9505 1703 0305  ....g...........
	0x0040:  8500 0000 0200 029d 8364 83eb 5250 fe97  .........d..RP..
	0x0050:  5e5f 15d9 020b 6b74 8086 e7ab 69e5 5a21  ^_....kt....i.Z!
	0x0060:  eaae 478d fe00 9eee d0c7 1ad3 18fb 2d4a  ..G...........-J
	0x0070:  e1b8 5166 e70e d069 8e7e 0565 ede9 3b5c  ..Qf...i.~.e..;\
	0x0080:  982f 32c8 8a33 537f f1e2 15c7 ea3b c066  ./2..3S......;.f
	0x0090:  3dc3 d4ce d25b 5a20 47ee 4131 3b0b 5d76  =....[Z.G.A1;.]v
	0x00a0:  f492 538e 290d 0fb3 33c8 abc9 7bfd 2922  ..S.)...3...{.)"
	0x00b0:  5a1d 0a11 05fe cf4c 89fc efa4 a306 c025  Z......L.......%
	0x00c0:  f49c 5d1c 994a a772 3a33 193c 8b6e e68c  ..]..J.r:3.<.n..
	0x00d0:  e172 ec6f 42b8 7175 671e cfd2 add2 2863  .r.oB.qug.....(c
	0x00e0:  a3e5 6b16 b3fc 35a6 3fc0 42b4 a754 85cd  ..k...5.?.B..T..
	0x00f0:  78af 65c5 7742 5d13 ace2 8f21 7754 591a  x.e.wB]....!wTY.
	0x0100:  88c3 1976 80bb 71c3 00a0 f372 9a71 7db6  ...v..q....r.q}.
	0x0110:  4fcd f875 8fe5 14b4 ea8d e8b2 e34f bb55  O..u.........O.U
	0x0120:  d65c 9f6d 085f 7332 0821 b226 3712 12f1  .\.m._s2.!.&7...
	0x0130:  7199 81b3 38e6 8f38 4026 f698 5fa5 61da  q...8..8@&.._.a.
	0x0140:  7d1d eb35 5f78 79d5 7c2b f3d2 a54e 10c7  }..5_xy.|+...N..
	0x0150:  8d6c 96e3 8f2d ed23 af64 96b9 137a 626e  .l...-.#.d...zbn
	0x0160:  bdac fb94 9513 202a 561c 2c01 6712 06d4  .......*V.,.g...
	0x0170:  8f5c 71bb cb09 37a2 312c 5ce5 0e02 5060  .\q...7.1,\...P`
	0x0180:  340d 4f0f a7e2 48ad b232 ade4 2a48 ed2f  4.O...H..2..*H./
	0x0190:  24db c934 de02 3fb7 4b4f 6f10 e83a 3fec  $..4..?.KOo..:?.
	0x01a0:  6848 0fc5 3445 9386 9172 9e1b b317 cf80  hH..4E...r......
	0x01b0:  2629 d9b4 7b30 35f8 80a6 d224 6016 bc39  &)..{05....$`..9
	0x01c0:  1a28 8251 e265 8ee1 f761 d190 6230 e899  .(.Q.e...a..b0..
	0x01d0:  89c5 64d3 8e93 6b29 6b65 bc35 0783 2a2a  ..d...k)ke.5..**
	0x01e0:  a108 e003 6def 79a2 1981 aec4 a621 47b3  ....m.y......!G.
	0x01f0:  7193 dd15 6bc4 eef5 d56b 1869 1fbf a3a7  q...k....k.i....
	0x0200:  daaf 41c3 6330 e3fc 5aa9 3354 6b88 7189  ..A.c0..Z.3Tk.q.
	0x0210:  a3fc 4299 304c cbc9 f7c3 9190 5802 473e  ..B.0L......X.G>
	0x0220:  d08e a078 ea76 6bcc 3d94 3206 cd33 a773  ...x.vk.=.2..3.s
	0x0230:  0f12 50e8 55ae 8242 b4a7 67f6 7dbd 8ba0  ..P.U..B..g.}...
	0x0240:  3dd2 d7f4 444d adc1 e9f1 2edf 087a a0e2  =...DM.......z..
	0x0250:  b9d9 1848 7e83 00ac c694 cffe e386 1521  ...H~..........!
	0x0260:  7e6d 3c5e 6165 5cd0 d65b b288 622f 8de6  ~m<^ae\..[..b/..
	0x0270:  332d 0696 5e22 2784 fe9a 222a 9d3b 53bf  3-..^"'..."*.;S.
	0x0280:  aba2 0ada 7d60 022e adaf bed7 f5a2 59ed  ....}`........Y.
	0x0290:  238d 06bf 03e4 c466 6b72 7487 a17c 6a8d  #......fkrt..|j.
	0x02a0:  5afa fc77 017f b0c7 32d2 e105 4c10 17c4  Z..w....2...L...
	0x02b0:  fd02 6d8f 421c c42d a42d 5fca ecee a019  ..m.B..-.-_.....
	0x02c0:  baf1 bf3c 0eab c23d 1c18 e1f0 e3a0 e6d6  ...<...=........
	0x02d0:  4423 1ab7 1718 71f8 823e a756 973d 4aa9  D#....q..>.V.=J.
	0x02e0:  eee1 38d1 26e8 8a13 3462 a0b0 10ff 0d16  ..8.&...4b......
	0x02f0:  e8ea 8526 35f2 cbed f5a6 44c5 5aa7 0ece  ...&5.....D.Z...
	0x0300:  8d72 2db4 cccf 2a99 1a72 d86c e450 9815  .r-...*..r.l.P..
	0x0310:  1b63 0277 f0b8 139a 2917 56b3 2845 c977  .c.w....).V.(E.w
	0x0320:  a1b9 b725 d68f 6a8c fb0b 1ffb 6f2f a681  ...%..j.....o/..
	0x0330:  0388 fbe7 fa75 dfe0 0393 4d53 67c8 9e94  .....u....MSg...
	0x0340:  0ca1 c6f6 3001 46c2 bc53 5afe bde7 07ef  ....0.F..SZ.....
	0x0350:  4009 6440 dc6a 05d3 f0b1 bc9b cfe5 6ae9  @.d@.j........j.
	0x0360:  1bc3 861d c7b4 df16 bdc0 ed34 9295 a98a  ...........4....
	0x0370:  8252 61b4 823f ee13 625f f76e d86c afdb  .Ra..?..b_.n.l..
	0x0380:  6a55 c4c9 af6e 2d28 e2e9 4b21 6c5e 10d6  jU...n-(..K!l^..
	0x0390:  7f41 70ac 3650 4a4d bb55 3183 8540 e465  .Ap.6PJM.U1..@.e
	0x03a0:  8f6e 883f 4f75 467f 575c 9b52 3e22 ec07  .n.?OuF.W\.R>"..
	0x03b0:  c921 1306 f89f 25a9 dcc8 8bb0 fb46 6532  .!....%......Fe2
	0x03c0:  ac7a 91df 21ae 975b eba8 9de3 6602 e067  .z..!..[....f..g
	0x03d0:  2f18 b6f2 2310 51ad 03bc 3013 ce39 ca03  /...#.Q...0..9..
	0x03e0:  cf0e 30bb db63 9326 02dc fd90 5efe 6e7d  ..0..c.&....^.n}
	0x03f0:  d2f1 36cb 19ee e7f7 c2b8 ae95 f700 623f  ..6...........b?
	0x0400:  c673 e8eb b887 35b9 440a 3627 0bd1 c9bb  .s....5.D.6'....
	0x0410:  29e6 b36d 5b73 f894 f06d 990f 0a34 0720  )..m[s...m...4..
	0x0420:  508d 15f9 3b71 be26 8c8d 656e 9475 9dc6  P...;q.&..en.u..
	0x0430:  0afd 0e27 ad61 3df2 10be 1e44 81da da03  ...'.a=....D....
	0x0440:  7eff c414 6c35 885f 34ee a5d1 6ec1 1234  ~...l5._4...n..4
	0x0450:  bc6b 2425 1986 6ffd 4bb1 f70e f8e7 f56c  .k$%..o.K......l
	0x0460:  386d 83bd 334a b054 5690 a2c2 af7a 0c0e  8m..3J.TV....z..
	0x0470:  2458 e400 e02a 114a eabd ec08 4433 913e  $X...*.J....D3.>
	0x0480:  a3e8 eb41 bcfb 247d ba06 dd0e d29f 03ac  ...A..$}........
	0x0490:  8392 c0e1 ef63 dbd6 3a56 ec46 c38f ed0e  .....c..:V.F....
	0x04a0:  cc3d 2a43 0e21 9661 ff21 f73e ceac c557  .=*C.!.a.!.>...W
	0x04b0:  3732 7e56 2f9c 5ca0 0cdc ede0 a214 c82d  72~V/.\........-
	0x04c0:  d0f1 97d6 ece1 6364 7678 3df9 d65f dc9e  ......cdvx=.._..
	0x04d0:  ce54 76ce 5eba 45e4 d77c 9418 8790 b0a4  .Tv.^.E..|......
	0x04e0:  69a4 f5da 40f0 00c0 f144 28df 4423 ae40  i...@....D(.D#.@
	0x04f0:  fd38 97de 5153 3121 7a30 2440 4f41 bc8e  .8..QS1!z0$@OA..
	0x0500:  4fab 6262 90bf 5a9c fe18 80c9 a605 961c  O.bb..Z.........
	0x0510:  62d3 6fe4 562c b48e 7a53 169d 6deb 1f4d  b.o.V,..zS..m..M
	0x0520:  5136 51ef 6cb5 f9e2 253a 7d6e 57c5 e1c0  Q6Q.l...%:}nW...
	0x0530:  aa5f a863 9d2b d96a a6d7 f08c 693c a500  ._.c.+.j....i<..
	0x0540:  9dd6 87b1 235e b3f2 fbe7 11e3 7b8c bcb8  ....#^......{...
	0x0550:  6e71 58f1 ddbc 8d50 318d 132c 98dd 64b1  nqX....P1..,..d.
	0x0560:  55a8 f9fc d076 3454 2019 5f64 2490 4459  U....v4T.._d$.DY
	0x0570:  5150 189e 433f d304 2483 2b7a b1dc 9677  QP..C?..$.+z...w
	0x0580:  a67b c42f c86c 4264 1807 5af2 b560 16ec  .{./.lBd..Z..`..
	0x0590:  61e6 6ab2 df6d 1cc0 fd96 0d3b 2d85 d39b  a.j..m.....;-...
	0x05a0:  cd2b 31c4 c362 1c66 fbd0 664e 91ed c7ec  .+1..b.f..fN....
	0x05b0:  64cb 92f6 4d67 993d 9fce fe92 e9f8 7c46  d...Mg.=......|F
	0x05c0:  dce5 2e23 ab8b                           ...#..
  123  15:51:28.031471 2417859849us tsft bad-fcs -93dBm noise antenna 1 5785 MHz 11a ht/20 User 0 MCS 2 LDPC FEC 80 MHz long GI IP 130.211.14.80.443 > 192.168.1.14.63881: Flags [.], seq 6830:8248, ack 3606, win 1099, options [nop,nop,TS val 1736380033 ecr 2250019845], length 1418
  124  15:51:28.033571 2417862002us tsft -93dBm noise antenna 1 5785 MHz 11a ht/20 User 0 MCS 5 LDPC FEC 80 MHz long GI IP 192.168.1.14.63881 > 130.211.14.80.443: Flags [.], ack 9652, win 4007, options [nop,nop,TS val 2250020669 ecr 1736380033], length 0
  125  15:51:28.033651 2417862002us tsft -65dBm signal -93dBm noise antenna 1 5785 MHz 11a ht/20 [|802.11]IP 192.168.1.14.63881 > 130.211.14.80.443: Flags [.], ack 9652, win 4096, options [nop,nop,TS val 2250020669 ecr 1736380033], length 0
  126  15:51:28.033939 2417862223us tsft -93dBm noise antenna 1 5785 MHz 11a ht/20 User 0 MCS 5 LDPC FEC 80 MHz long GI IP 192.168.1.14.63881 > 130.211.14.80.443: Flags [.], ack 9652, win 4007, options [nop,nop,TS val 2250020669 ecr 1736380033], length 0
  127  15:51:28.034014 2417862223us tsft -65dBm signal -93dBm noise antenna 1 5785 MHz 11a ht/20 [|802.11]IP 192.168.1.14.63881 > 130.211.14.80.443: Flags [.], ack 9652, win 4096, options [nop,nop,TS val 2250020669 ecr 1736380033], length 0
  128  15:51:28.135399 2417963866us tsft bad-fcs -51dBm signal -93dBm noise antenna 1 5785 MHz 11a ht/20 [|802.11]IP 130.211.14.80.443 > 192.168.1.14.63881: Flags [.], seq 12488:13906, ack 3606, win 1099, options [nop,nop,TS val 1736380037 ecr 2250019845], length 1418
  129  15:51:28.140416 2417968796us tsft -55dBm signal -93dBm noise antenna 1 5785 MHz 11a ht/20 [|802.11]IP 130.211.14.80.443 > 192.168.1.14.63881: Flags [.], seq 12488:13906, ack 3606, win 1099, options [nop,nop,TS val 1736380037 ecr 2250019845], length 1418
  130  15:51:28.193781 2418022200us tsft bad-fcs -93dBm noise antenna 1 5785 MHz 11a ht/20 User 0 MCS 2 LDPC FEC 80 MHz long GI IP 130.211.14.80.443 > 192.168.1.14.63881: Flags [.], seq 13906:15324, ack 3606, win 1099, options [nop,nop,TS val 1736380037 ecr 2250019845], length 1418
  131  15:51:28.193855 2418022200us tsft bad-fcs -51dBm signal -93dBm noise antenna 1 5785 MHz 11a ht/20 [|802.11]IP 130.211.14.80.443 > 192.168.1.14.63881: Flags [.], seq 15324:16742, ack 3606, win 1099, options [nop,nop,TS val 1736380038 ecr 2250019845], length 1418
  132  15:51:28.196852 2418025317us tsft -93dBm noise antenna 1 5785 MHz 11a ht/20 User 0 MCS 5 LDPC FEC 80 MHz long GI IP 192.168.1.14.63881 > 130.211.14.80.443: Flags [.], ack 15324, win 4051, options [nop,nop,TS val 2250020829 ecr 1736380037], length 0
  133  15:51:28.196961 2418025317us tsft -61dBm signal -93dBm noise antenna 1 5785 MHz 11a ht/20 [|802.11]IP 192.168.1.14.63881 > 130.211.14.80.443: Flags [.], ack 16742, win 4096, options [nop,nop,TS val 2250020829 ecr 1736380038], length 0
  134  15:51:28.287048 2418115480us tsft -51dBm signal -93dBm noise antenna 1 5785 MHz 11a ht/20 [|802.11]IP 130.211.14.80.443 > 192.168.1.14.63881: Flags [.], seq 16742:18160, ack 3606, win 1099, options [nop,nop,TS val 1736380038 ecr 2250019845], length 1418
  135  15:51:28.353407 2418181958us tsft bad-fcs -93dBm noise antenna 1 5785 MHz 11a ht/20 User 0 MCS 2 LDPC FEC 80 MHz long GI IP 130.211.14.80.443 > 192.168.1.14.63881: Flags [.], seq 18160:19578, ack 3606, win 1099, options [nop,nop,TS val 1736380040 ecr 2250019845], length 1418
  136  15:51:28.353481 2418181958us tsft bad-fcs -51dBm signal -93dBm noise antenna 1 5785 MHz 11a ht/20 [|802.11]IP 130.211.14.80.443 > 192.168.1.14.63881: Flags [.], seq 19578:20996, ack 3606, win 1099, options [nop,nop,TS val 1736380040 ecr 2250019845], length 1418
  137  15:51:28.355251 2418183685us tsft -93dBm noise antenna 1 5785 MHz 11a ht/20 User 0 MCS 2 LDPC FEC 80 MHz long GI IP 130.211.14.80.443 > 192.168.1.14.63881: Flags [.], seq 18160:19578, ack 3606, win 1099, options [nop,nop,TS val 1736380040 ecr 2250019845], length 1418
  138  15:51:28.355333 2418183685us tsft -50dBm signal -93dBm noise antenna 1 5785 MHz 11a ht/20 [|802.11]IP 130.211.14.80.443 > 192.168.1.14.63881: Flags [.], seq 19578:20996, ack 3606, win 1099, options [nop,nop,TS val 1736380040 ecr 2250019845], length 1418
  139  15:51:28.384833 2418213279us tsft -93dBm noise antenna 1 5785 MHz 11a ht/20 User 0 MCS 2 LDPC FEC 80 MHz long GI IP 192.168.1.14.63881 > 130.211.14.80.443: Flags [.], ack 19578, win 4051, options [nop,nop,TS val 2250020989 ecr 1736380038], length 0
