    1  15:59:26.199502 2896022478us tsft -77dBm noise antenna 1 5785 MHz 11a ht/20 User 0 MCS 9 LDPC FEC 80 MHz (L) short GI IP 54.215.132.170.443 > 192.168.1.12.60323: Flags [P.], seq 199241942:199241988, ack 1446394690, win 114, options [nop,nop,TS val 1315653045 ecr 1202525394], length 46
    2  15:59:26.199610 2896022478us tsft -61dBm signal -77dBm noise antenna 1 5785 MHz 11a ht/20 [|802.11]IP 54.215.132.170.443 > 192.168.1.12.60323: Flags [FP.], seq 46:77, ack 1, win 114, options [nop,nop,TS val 1315653045 ecr 1202525394], length 31
    3  15:59:26.204191 2896027289us tsft -59dBm signal -77dBm noise antenna 1 5785 MHz 11a ht/20 [|802.11]IP 192.168.1.12.60323 > 54.215.132.170.443: Flags [F.], seq 32, ack 78, win 1024, options [nop,nop,TS val 1202585376 ecr 1315653045], length 0
    4  15:59:26.396028 2896219037us tsft -42dBm signal -77dBm noise antenna 1 5785 MHz 11a ht/20 [|802.11]IP 192.168.1.11.57592 > 130.211.14.80.443: Flags [S], seq 2047481963, win 65535, options [mss 1460,nop,wscale 6,nop,nop,TS val 1662274943 ecr 0,sackOK,eol], length 0
    5  15:59:26.507731 2896330821us tsft -58dBm signal -77dBm noise antenna 1 5785 MHz 11a ht/20 [|802.11]IP 130.211.14.80.443 > 192.168.1.15.55352: Flags [S.], seq 1729170008, ack 2047481964, win 60192, options [mss 1380,sackOK,TS val 724126402 ecr 1662274943,nop,wscale 8], length 0
    6  15:59:26.507893 2896330941us tsft -77dBm noise antenna 1 5785 MHz 11a ht/20 User 0 MCS 8 LDPC FEC 80 MHz short GI IP 54.215.132.170.443 > 192.168.1.12.60323: Flags [R], seq 199242020, win 0, length 0
    7  15:59:26.507969 2896330941us tsft -59dBm signal -77dBm noise antenna 1 5785 MHz 11a ht/20 [|802.11]IP 54.215.132.170.443 > 192.168.1.12.60323: Flags [R], seq 199242020, win 0, length 0
    8  15:59:26.509168 2896332298us tsft -59dBm signal -77dBm noise antenna 1 5785 MHz 11a ht/20 [|802.11]IP 54.215.132.170.443 > 192.168.1.12.60323: Flags [R], seq 199242020, win 0, length 0
    9  15:59:26.511146 2896334341us tsft -54dBm signal -77dBm noise antenna 1 5785 MHz 11a ht/20 [|802.11]IP 192.168.1.15.55352 > 130.211.14.80.443: Flags [R], seq 2047481964, win 0, length 0
   10  15:59:26.512477 2896335479us tsft -60dBm signal -77dBm noise antenna 1 5785 MHz 11a ht/20 [|802.11]IP 54.215.132.170.443 > 192.168.1.12.60323: Flags [R], seq 199242020, win 0, length 0
   11  15:59:26.656741 2896480068us tsft -77dBm noise antenna 1 5785 MHz 11a ht/20 User 0 MCS 7 LDPC FEC 80 MHz long GI IP 192.168.1.14.64088 > 130.211.14.80.443: Flags [P.], seq 3039117032:3039117097, ack 5745975, win 4096, options [nop,nop,TS val 2250498094 ecr 2294739534], length 65
   12  15:59:26.656899 2896480068us tsft -77dBm noise antenna 1 5785 MHz 11a ht/20 User 0 MCS 7 LDPC FEC 80 MHz long GI IP 192.168.1.14.64088 > 130.211.14.80.443: Flags [.], seq 65:1253, ack 1, win 4096, options [nop,nop,TS val 2250498094 ecr 2294739534], length 1188
   13  15:59:26.656977 2896480068us tsft -43dBm signal -77dBm noise antenna 1 5785 MHz 11a ht/20 [|802.11]IP 192.168.1.14.64088 > 130.211.14.80.443: Flags [P.], seq 1253:1747, ack 1, win 4096, options [nop,nop,TS val 2250498094 ecr 2294739534], length 494
   14  15:59:26.818963 2896642220us tsft -54dBm signal -77dBm noise antenna 1 5785 MHz 11a ht/20 [|802.11]IP 192.168.1.15.55352 > 130.211.14.80.443: Flags [R], seq 2047481964, win 0, length 0
   15  15:59:27.380591 2897203447us tsft -77dBm noise antenna 1 5785 MHz 11a ht/20 User 0 MCS 7 LDPC FEC 80 MHz long GI IP 192.168.1.14.64088 > 130.211.14.80.443: Flags [.], ack 73, win 4093, options [nop,nop,TS val 2250498806 ecr 2294758324], length 0
   16  15:59:27.380698 2897203447us tsft -77dBm noise antenna 1 5785 MHz 11a ht/20 User 0 MCS 7 LDPC FEC 80 MHz long GI IP 192.168.1.14.64088 > 130.211.14.80.443: Flags [.], ack 1491, win 4049, options [nop,nop,TS val 2250498806 ecr 2294758324], length 0
   17  15:59:27.380773 2897203447us tsft -77dBm noise antenna 1 5785 MHz 11a ht/20 User 0 MCS 7 LDPC FEC 80 MHz long GI IP 192.168.1.14.64088 > 130.211.14.80.443: Flags [.], ack 2814, win 4008, options [nop,nop,TS val 2250498806 ecr 2294758325], length 0
   18  15:59:27.380848 2897203447us tsft -77dBm noise antenna 1 5785 MHz 11a ht/20 User 0 MCS 7 LDPC FEC 80 MHz long GI IP 192.168.1.14.64088 > 130.211.14.80.443: Flags [.], ack 4232, win 3963, options [nop,nop,TS val 2250498806 ecr 2294758328], length 0
   19  15:59:27.380923 2897203447us tsft -77dBm noise antenna 1 5785 MHz 11a ht/20 User 0 MCS 7 LDPC FEC 80 MHz long GI IP 192.168.1.14.64088 > 130.211.14.80.443: Flags [.], ack 7068, win 3877, options [nop,nop,TS val 2250498806 ecr 2294758329], length 0
   20  15:59:27.380998 2897203447us tsft -77dBm noise antenna 1 5785 MHz 11a ht/20 User 0 MCS 7 LDPC FEC 80 MHz long GI IP 192.168.1.14.64088 > 130.211.14.80.443: Flags [.], ack 7134, win 3875, options [nop,nop,TS val 2250498806 ecr 2294758331], length 0
   21  15:59:27.381073 2897203447us tsft -77dBm noise antenna 1 5785 MHz 11a ht/20 User 0 MCS 7 LDPC FEC 80 MHz long GI IP 192.168.1.14.64088 > 130.211.14.80.443: Flags [.], ack 8552, win 3831, options [nop,nop,TS val 2250498806 ecr 2294758332], length 0
   22  15:59:27.381147 2897203447us tsft -77dBm noise antenna 1 5785 MHz 11a ht/20 User 0 MCS 7 LDPC FEC 80 MHz long GI IP 192.168.1.14.64088 > 130.211.14.80.443: Flags [.], ack 8835, win 3822, options [nop,nop,TS val 2250498806 ecr 2294758333], length 0
   23  15:59:27.381223 2897203447us tsft -44dBm signal -77dBm noise antenna 1 5785 MHz 11a ht/20 [|802.11]IP 192.168.1.14.64088 > 130.211.14.80.443: Flags [.], ack 8835, win 4096, options [nop,nop,TS val 2250498806 ecr 2294758333], length 0
   24  15:59:27.381603 2897204030us tsft -43dBm signal -77dBm noise antenna 1 5785 MHz 11a ht/20 [|802.11]IP 192.168.1.14.64088 > 130.211.14.80.443: Flags [P.], seq 1747:1793, ack 8835, win 4096, options [nop,nop,TS val 2250498807 ecr 2294758333], length 46
   25  15:59:27.436234 2897259162us tsft -55dBm signal -77dBm noise antenna 1 5785 MHz 11a ht/20 [|802.11]IP 130.211.14.80.443 > 192.168.1.14.64088: Flags [.], ack 1793, win 1050, options [nop,nop,TS val 2294758615 ecr 2250498807], length 0
   26  15:59:27.483299 2897306262us tsft -77dBm noise antenna 1 5785 MHz 11a ht/20 User 0 MCS 9 LDPC FEC 80 MHz long GI IP 192.168.1.14.64088 > 130.211.14.80.443: Flags [P.], seq 1793:1858, ack 8835, win 4096, options [nop,nop,TS val 2250498949 ecr 2294758615], length 65
   27  15:59:27.483387 2897306262us tsft -77dBm noise antenna 1 5785 MHz 11a ht/20 User 0 MCS 9 LDPC FEC 80 MHz long GI IP 192.168.1.14.64088 > 130.211.14.80.443: Flags [.], seq 1858:3046, ack 8835, win 4096, options [nop,nop,TS val 2250498949 ecr 2294758615], length 1188
   28  15:59:27.483462 2897306262us tsft -43dBm signal -77dBm noise antenna 1 5785 MHz 11a ht/20 [|802.11]IP 192.168.1.14.64088 > 130.211.14.80.443: Flags [P.], seq 3046:3268, ack 8835, win 4096, options [nop,nop,TS val 2250498949 ecr 2294758615], length 222
   29  15:59:27.575175 2897398214us tsft -77dBm noise antenna 1 5785 MHz 11a ht/20 User 0 MCS 6 LDPC FEC 80 MHz long GI IP 130.211.14.80.443 > 192.168.1.14.64088: Flags [.], ack 1858, win 1050, options [nop,nop,TS val 2294758736 ecr 2250498949], length 0
   30  15:59:27.575262 2897398214us tsft -77dBm noise antenna 1 5785 MHz 11a ht/20 User 0 MCS 6 LDPC FEC 80 MHz long GI IP 130.211.14.80.443 > 192.168.1.14.64088: Flags [.], ack 3046, win 1050, options [nop,nop,TS val 2294758742 ecr 2250498949], length 0
   31  15:59:27.575336 2897398214us tsft -55dBm signal -77dBm noise antenna 1 5785 MHz 11a ht/20 [|802.11]IP 130.211.14.80.443 > 192.168.1.14.64088: Flags [.], ack 3268, win 1050, options [nop,nop,TS val 2294758742 ecr 2250498949], length 0
   32  15:59:27.577787 2897400773us tsft -77dBm noise antenna 1 5785 MHz 11a ht/20 User 0 MCS 6 LDPC FEC 80 MHz short GI IP 192.168.1.11.50831 > 130.211.14.80.443: Flags [P.], seq 282349690:282349756, ack 1005271724, win 1024, options [nop,nop,TS val 1663313676 ecr 724122642], length 66
   33  15:59:27.577872 2897400773us tsft -77dBm noise antenna 1 5785 MHz 11a ht/20 User 0 MCS 6 LDPC FEC 80 MHz short GI IP 192.168.1.11.50831 > 130.211.14.80.443: Flags [.], seq 66:1254, ack 1, win 1024, options [nop,nop,TS val 1663313676 ecr 724122642], length 1188
   34  15:59:27.577948 2897400773us tsft -45dBm signal -77dBm noise antenna 1 5785 MHz 11a ht/20 [|802.11]IP 192.168.1.11.50831 > 130.211.14.80.443: Flags [P.], seq 1254:1724, ack 1, win 1024, options [nop,nop,TS val 1663313676 ecr 724122642], length 470
   35  15:59:27.636299 2897459332us tsft -55dBm signal -77dBm noise antenna 1 5785 MHz 11a ht/20 [|802.11]IP 130.211.14.80.443 > 192.168.1.11.50831: Flags [.], ack 66, win 4435, options [nop,nop,TS val 724127603 ecr 1663313676], length 0
   36  15:59:27.643488 2897466633us tsft -77dBm noise antenna 1 5785 MHz 11a ht/20 User 0 MCS 6 LDPC FEC 80 MHz long GI IP 130.211.14.80.443 > 192.168.1.11.50831: Flags [.], ack 1254, win 4431, options [nop,nop,TS val 724127608 ecr 1663313676], length 0
   37  15:59:27.643595 2897466633us tsft -55dBm signal -77dBm noise antenna 1 5785 MHz 11a ht/20 [|802.11]IP 130.211.14.80.443 > 192.168.1.11.50831: Flags [.], ack 1724, win 4431, options [nop,nop,TS val 724127609 ecr 1663313676], length 0
   38  15:59:27.784230 2897607241us tsft -77dBm noise antenna 1 5785 MHz 11a ht/20 User 0 MCS 9 LDPC FEC 80 MHz long GI IP 192.168.1.14.64088 > 130.211.14.80.443: Flags [.], ack 8907, win 4093, options [nop,nop,TS val 2250499249 ecr 2294758927], length 0
   39  15:59:27.784315 2897607241us tsft -77dBm noise antenna 1 5785 MHz 11a ht/20 User 0 MCS 9 LDPC FEC 80 MHz long GI IP 192.168.1.14.64088 > 130.211.14.80.443: Flags [.], ack 10325, win 4049, options [nop,nop,TS val 2250499249 ecr 2294758927], length 0
   40  15:59:27.784390 2897607241us tsft -77dBm noise antenna 1 5785 MHz 11a ht/20 User 0 MCS 9 LDPC FEC 80 MHz long GI IP 192.168.1.14.64088 > 130.211.14.80.443: Flags [.], ack 10598, win 4040, options [nop,nop,TS val 2250499249 ecr 2294758928], length 0
   41  15:59:27.784466 2897607241us tsft -77dBm noise antenna 1 5785 MHz 11a ht/20 User 0 MCS 9 LDPC FEC 80 MHz long GI IP 192.168.1.14.64088 > 130.211.14.80.443: Flags [.], ack 10816, win 4034, options [nop,nop,TS val 2250499249 ecr 2294758929], length 0
   42  15:59:27.784541 2897607241us tsft -77dBm noise antenna 1 5785 MHz 11a ht/20 User 0 MCS 9 LDPC FEC 80 MHz long GI IP 192.168.1.14.64088 > 130.211.14.80.443: Flags [.], ack 10862, win 4032, options [nop,nop,TS val 2250499249 ecr 2294758929], length 0
   43  15:59:27.784617 2897607241us tsft -43dBm signal -77dBm noise antenna 1 5785 MHz 11a ht/20 [|802.11]IP 192.168.1.14.64088 > 130.211.14.80.443: Flags [P.], seq 3268:3314, ack 10862, win 4096, options [nop,nop,TS val 2250499250 ecr 2294758929], length 46
   44  15:59:28.251279 2898074359us tsft -41dBm signal -77dBm noise antenna 1 5785 MHz 11a ht/20 [|802.11]IP 192.168.1.11.50831 > 130.211.14.80.443: Flags [.], ack 73, win 1023, options [nop,nop,TS val 1663314353 ecr 724128175], length 0
   45  15:59:28.256597 2898079572us tsft -77dBm noise antenna 1 5785 MHz 11a ht/20 User 0 MCS 6 LDPC FEC 80 MHz short GI IP 192.168.1.11.50831 > 130.211.14.80.443: Flags [.], ack 1491, win 1012, options [nop,nop,TS val 1663314355 ecr 724128175], length 0
   46  15:59:28.256701 2898079572us tsft -77dBm noise antenna 1 5785 MHz 11a ht/20 User 0 MCS 6 LDPC FEC 80 MHz short GI IP 192.168.1.11.50831 > 130.211.14.80.443: Flags [.], ack 4123, win 992, options [nop,nop,TS val 1663314355 ecr 724128175], length 0
   47  15:59:28.256774 2898079572us tsft -77dBm noise antenna 1 5785 MHz 11a ht/20 User 0 MCS 6 LDPC FEC 80 MHz short GI IP 192.168.1.11.50831 > 130.211.14.80.443: Flags [.], ack 5541, win 981, options [nop,nop,TS val 1663314355 ecr 724128179], length 0
   48  15:59:28.256848 2898079572us tsft -77dBm noise antenna 1 5785 MHz 11a ht/20 User 0 MCS 6 LDPC FEC 80 MHz short GI IP 192.168.1.11.50831 > 130.211.14.80.443: Flags [.], ack 8377, win 959, options [nop,nop,TS val 1663314355 ecr 724128179], length 0
   49  15:59:28.256922 2898079572us tsft -41dBm signal -77dBm noise antenna 1 5785 MHz 11a ht/20 [|802.11]IP 192.168.1.11.50831 > 130.211.14.80.443: Flags [.], ack 9198, win 952, options [nop,nop,TS val 1663314355 ecr 724128180], length 0
   50  15:59:28.293407 2898116354us tsft -77dBm noise antenna 1 5785 MHz 11a ht/20 User 0 MCS 4 LDPC FEC 80 MHz short GI IP 192.168.1.11.50831 > 130.211.14.80.443: Flags [.], ack 9198, win 1024, options [nop,nop,TS val 1663314355 ecr 724128180], length 0
   51  15:59:28.293510 2898116354us tsft -41dBm signal -77dBm noise antenna 1 5785 MHz 11a ht/20 [|802.11]IP 192.168.1.11.50831 > 130.211.14.80.443: Flags [P.], seq 1724:1770, ack 9198, win 1024, options [nop,nop,TS val 1663314355 ecr 724128180], length 46
   52  15:59:28.337128 2898160080us tsft -55dBm signal -77dBm noise antenna 1 5785 MHz 11a ht/20 [|802.11]IP 130.211.14.80.443 > 192.168.1.11.50831: Flags [.], ack 1770, win 4435, options [nop,nop,TS val 724128297 ecr 1663314355], length 0
   53  15:59:30.042237 2899865329us tsft -60dBm signal -77dBm noise antenna 1 5785 MHz 11a ht/20 [|802.11]IP 74.125.203.188.5228 > 192.168.1.13.50640: Flags [.], ack 2956914196, win 259, options [nop,nop,TS val 3729667517 ecr 347816079], length 0
   54  15:59:30.502629 2900325714us tsft -57dBm signal -77dBm noise antenna 1 5785 MHz 11a ht/20 [|802.11]IP 162.125.35.134.443 > 192.168.1.13.50765: Flags [P.], seq 2333540565:2333540780, ack 1400249420, win 248, options [nop,nop,TS val 3419160798 ecr 347904609], length 215
   55  15:59:30.693258 2900516557us tsft -59dBm signal -77dBm noise antenna 1 5785 MHz 11a ht/20 [|802.11]IP 162.125.35.134.443 > 192.168.1.13.50765: Flags [.], ack 3387, win 265, options [nop,nop,TS val 3419161015 ecr 347952885], length 0
   56  15:59:30.754077 2900577213us tsft -59dBm signal -77dBm noise antenna 1 5785 MHz 11a ht/20 [|802.11]IP 162.125.35.134.443 > 192.168.1.13.50765: Flags [.], ack 4355, win 270, options [nop,nop,TS val 3419161058 ecr 347952885], length 0
   57  15:59:30.754219 2900577348us tsft -77dBm noise antenna 1 5785 MHz 11a ht/20 User 0 MCS 7 LDPC FEC 80 MHz short GI IP 130.211.14.80.443 > 192.168.1.15.55708: Flags [.], ack 2771044009, win 1815, options [nop,nop,TS val 1906193186 ecr 1155054176], length 0
   58  15:59:30.754295 2900577348us tsft -77dBm noise antenna 1 5785 MHz 11a ht/20 User 0 MCS 7 LDPC FEC 80 MHz short GI IP 130.211.14.80.443 > 192.168.1.15.55708: Flags [.], ack 1369, win 1826, options [nop,nop,TS val 1906193201 ecr 1155054176], length 0
   59  15:59:30.754370 2900577348us tsft -77dBm noise antenna 1 5785 MHz 11a ht/20 User 0 MCS 7 LDPC FEC 80 MHz short GI IP 130.211.14.80.443 > 192.168.1.15.55708: Flags [.], ack 2049, win 1836, options [nop,nop,TS val 1906193201 ecr 1155054176], length 0
   60  15:59:30.754444 2900577348us tsft -59dBm signal -77dBm noise antenna 1 5785 MHz 11a ht/20 [|802.11]IP 130.211.14.80.443 > 192.168.1.15.55708: Flags [.], ack 2699, win 1847, options [nop,nop,TS val 1906193201 ecr 1155054176], length 0
   61  15:59:30.794344 2900617509us tsft -77dBm noise antenna 1 5785 MHz 11a ht/20 User 0 MCS 7 LDPC FEC 80 MHz short GI IP 130.211.14.80.443 > 192.168.1.15.55708: Flags [P.], seq 0:72, ack 2699, win 1847, options [nop,nop,TS val 1906193564 ecr 1155054176], length 72
   62  15:59:30.794451 2900617509us tsft -77dBm noise antenna 1 5785 MHz 11a ht/20 User 0 MCS 7 LDPC FEC 80 MHz short GI IP 130.211.14.80.443 > 192.168.1.15.55708: Flags [P.], seq 72:1490, ack 2699, win 1847, options [nop,nop,TS val 1906193564 ecr 1155054176], length 1418
   63  15:59:30.794527 2900617509us tsft -77dBm noise antenna 1 5785 MHz 11a ht/20 User 0 MCS 7 LDPC FEC 80 MHz short GI IP 130.211.14.80.443 > 192.168.1.15.55708: Flags [.], seq 1490:2908, ack 2699, win 1847, options [nop,nop,TS val 1906193565 ecr 1155054176], length 1418
   64  15:59:30.794657 2900617509us tsft -77dBm noise antenna 1 5785 MHz 11a ht/20 User 0 MCS 7 LDPC FEC 80 MHz short GI IP 130.211.14.80.443 > 192.168.1.15.55708: Flags [P.], seq 2908:4146, ack 2699, win 1847, options [nop,nop,TS val 1906193565 ecr 1155054176], length 1238
   65  15:59:30.794733 2900617509us tsft -77dBm noise antenna 1 5785 MHz 11a ht/20 User 0 MCS 7 LDPC FEC 80 MHz short GI IP 130.211.14.80.443 > 192.168.1.15.55708: Flags [P.], seq 4146:5564, ack 2699, win 1847, options [nop,nop,TS val 1906193573 ecr 1155054176], length 1418
   66  15:59:30.794808 2900617509us tsft -60dBm signal -77dBm noise antenna 1 5785 MHz 11a ht/20 [|802.11]IP 130.211.14.80.443 > 192.168.1.15.55708: Flags [.], seq 5564:6982, ack 2699, win 1847, options [nop,nop,TS val 1906193574 ecr 1155054176], length 1418
   67  15:59:30.801108 2900624257us tsft -60dBm signal -77dBm noise antenna 1 5785 MHz 11a ht/20 [|802.11]IP 130.211.14.80.443 > 192.168.1.15.55708: Flags [P.], seq 12966:14384, ack 2699, win 1847, options [nop,nop,TS val 1906193590 ecr 1155054176], length 1418
   68  15:59:30.859996 2900682994us tsft -60dBm signal -77dBm noise antenna 1 5785 MHz 11a ht/20 [|802.11]IP 130.211.14.80.443 > 192.168.1.15.55708: Flags [P.], seq 23122:24030, ack 2699, win 1847, options [nop,nop,TS val 1906193601 ecr 1155054176], length 908
   69  15:59:30.866308 2900689287us tsft -61dBm signal -77dBm noise antenna 1 5785 MHz 11a ht/20 [|802.11]IP 130.211.14.80.443 > 192.168.1.15.55708: Flags [P.], seq 24030:25448, ack 2699, win 1847, options [nop,nop,TS val 1906193612 ecr 1155054176], length 1418
   70  15:59:30.895810 2900718765us tsft -54dBm signal -77dBm noise antenna 1 5785 MHz 11a ht/20 [|802.11]IP 192.168.1.15.55708 > 130.211.14.80.443: Flags [.], ack 25448, win 1012, options [nop,nop,TS val 1155054691 ecr 1906193612], length 0
   71  15:59:30.900553 2900723486us tsft bad-fcs -77dBm noise antenna 1 5785 MHz 11a ht/20 User 0 MCS 8 LDPC FEC 80 MHz short GI IP 130.211.14.80.443 > 192.168.1.15.55708: Flags [P.], seq 26866:28284, ack 2699, win 1847, options [nop,nop,TS val 1906193612 ecr 1155054176], length 1418
   72  15:59:30.900629 2900723486us tsft -60dBm signal -77dBm noise antenna 1 5785 MHz 11a ht/20 [|802.11]IP 130.211.14.80.443 > 192.168.1.15.55708: Flags [P.], seq 28284:28430, ack 2699, win 1847, options [nop,nop,TS val 1906193616 ecr 1155054176], length 146
   73  15:59:31.785660 2901608607us tsft -83dBm noise antenna 1 5785 MHz 11a ht/20 User 0 MCS 8 LDPC FEC 80 MHz long GI IP 192.168.1.12.60225 > 130.211.14.80.443: Flags [P.], seq 2365840848:2365840914, ack 2313645608, win 1024, options [nop,nop,TS val 1202590952 ecr 2415903074], length 66
   74  15:59:31.785748 2901608607us tsft -83dBm noise antenna 1 5785 MHz 11a ht/20 User 0 MCS 8 LDPC FEC 80 MHz long GI IP 192.168.1.12.60225 > 130.211.14.80.443: Flags [.], seq 66:1254, ack 1, win 1024, options [nop,nop,TS val 1202590952 ecr 2415903074], length 1188
   75  15:59:31.785822 2901608607us tsft -56dBm signal -83dBm noise antenna 1 5785 MHz 11a ht/20 [|802.11]IP 192.168.1.12.60225 > 130.211.14.80.443: Flags [P.], seq 1254:1700, ack 1, win 1024, options [nop,nop,TS val 1202590952 ecr 2415903074], length 446
   76  15:59:32.651060 2902474010us tsft -83dBm noise antenna 1 5785 MHz 11a ht/20 User 0 MCS 8 LDPC FEC 80 MHz short GI IP 130.211.14.80.443 > 192.168.1.12.60225: Flags [.], ack 66, win 4524, options [nop,nop,TS val 2415923667 ecr 1202590952], length 0
   77  15:59:32.651144 2902474010us tsft -83dBm noise antenna 1 5785 MHz 11a ht/20 User 0 MCS 8 LDPC FEC 80 MHz short GI IP 130.211.14.80.443 > 192.168.1.12.60225: Flags [.], ack 1254, win 4520, options [nop,nop,TS val 2415923674 ecr 1202590952], length 0
   78  15:59:32.651220 2902474010us tsft -83dBm noise antenna 1 5785 MHz 11a ht/20 User 0 MCS 8 LDPC FEC 80 MHz short GI IP 130.211.14.80.443 > 192.168.1.12.60225: Flags [.], ack 1700, win 4520, options [nop,nop,TS val 2415923674 ecr 1202590952], length 0
   79  15:59:32.651295 2902474010us tsft -83dBm noise antenna 1 5785 MHz 11a ht/20 User 0 MCS 8 LDPC FEC 80 MHz short GI IP 130.211.14.80.443 > 192.168.1.12.60225: Flags [P.], seq 1:73, ack 1700, win 4524, options [nop,nop,TS val 2415923885 ecr 1202590952], length 72
   80  15:59:32.651371 2902474010us tsft -83dBm noise antenna 1 5785 MHz 11a ht/20 User 0 MCS 8 LDPC FEC 80 MHz short GI IP 130.211.14.80.443 > 192.168.1.12.60225: Flags [P.], seq 73:1491, ack 1700, win 4524, options [nop,nop,TS val 2415923885 ecr 1202590952], length 1418
   81  15:59:32.651446 2902474010us tsft -83dBm noise antenna 1 5785 MHz 11a ht/20 User 0 MCS 8 LDPC FEC 80 MHz short GI IP 130.211.14.80.443 > 192.168.1.12.60225: Flags [P.], seq 1491:2909, ack 1700, win 4524, options [nop,nop,TS val 2415923885 ecr 1202590952], length 1418
   82  15:59:32.651522 2902474010us tsft -83dBm noise antenna 1 5785 MHz 11a ht/20 User 0 MCS 8 LDPC FEC 80 MHz short GI IP 130.211.14.80.443 > 192.168.1.12.60225: Flags [P.], seq 2909:4219, ack 1700, win 4524, options [nop,nop,TS val 2415923886 ecr 1202590952], length 1310
   83  15:59:32.651596 2902474010us tsft -83dBm noise antenna 1 5785 MHz 11a ht/20 User 0 MCS 8 LDPC FEC 80 MHz short GI IP 130.211.14.80.443 > 192.168.1.12.60225: Flags [P.], seq 4219:5637, ack 1700, win 4524, options [nop,nop,TS val 2415923887 ecr 1202590952], length 1418
   84  15:59:32.651672 2902474010us tsft -83dBm noise antenna 1 5785 MHz 11a ht/20 User 0 MCS 8 LDPC FEC 80 MHz short GI IP 130.211.14.80.443 > 192.168.1.12.60225: Flags [P.], seq 5637:7055, ack 1700, win 4524, options [nop,nop,TS val 2415923888 ecr 1202590952], length 1418
   85  15:59:32.651824 2902474010us tsft -83dBm noise antenna 1 5785 MHz 11a ht/20 User 0 MCS 8 LDPC FEC 80 MHz short GI IP 130.211.14.80.443 > 192.168.1.12.60225: Flags [.], seq 7055:8473, ack 1700, win 4524, options [nop,nop,TS val 2415923888 ecr 1202590952], length 1418
   86  15:59:32.651900 2902474010us tsft -83dBm noise antenna 1 5785 MHz 11a ht/20 User 0 MCS 8 LDPC FEC 80 MHz short GI IP 130.211.14.80.443 > 192.168.1.12.60225: Flags [P.], seq 8473:8574, ack 1700, win 4524, options [nop,nop,TS val 2415923888 ecr 1202590952], length 101
   87  15:59:32.651976 2902474010us tsft -83dBm noise antenna 1 5785 MHz 11a ht/20 User 0 MCS 8 LDPC FEC 80 MHz short GI IP 130.211.14.80.443 > 192.168.1.12.60225: Flags [P.], seq 8574:9755, ack 1700, win 4524, options [nop,nop,TS val 2415923889 ecr 1202590952], length 1181
   88  15:59:32.652052 2902474010us tsft -60dBm signal -83dBm noise antenna 1 5785 MHz 11a ht/20 [|802.11]IP 130.211.14.80.443 > 192.168.1.12.60225: Flags [P.], seq 8574:9755, ack 1700, win 4524, options [nop,nop,TS val 2415924175 ecr 1202590952], length 1181
   89  15:59:32.652685 2902475791us tsft -60dBm signal -83dBm noise antenna 1 5785 MHz 11a ht/20 [|802.11]IP 130.211.14.80.443 > 192.168.1.12.60225: Flags [P.], seq 8574:9755, ack 1700, win 4524, options [nop,nop,TS val 2415924175 ecr 1202590952], length 1181
   90  15:59:32.654078 2902477033us tsft -83dBm noise antenna 1 5785 MHz 11a ht/20 User 0 MCS 8 LDPC FEC 80 MHz long GI IP 192.168.1.12.60225 > 130.211.14.80.443: Flags [.], ack 73, win 1023, options [nop,nop,TS val 1202591822 ecr 2415923885], length 0
   91  15:59:32.654163 2902477033us tsft -83dBm noise antenna 1 5785 MHz 11a ht/20 User 0 MCS 8 LDPC FEC 80 MHz long GI IP 192.168.1.12.60225 > 130.211.14.80.443: Flags [.], ack 1491, win 1012, options [nop,nop,TS val 1202591822 ecr 2415923885], length 0
   92  15:59:32.654239 2902477033us tsft -83dBm noise antenna 1 5785 MHz 11a ht/20 User 0 MCS 8 LDPC FEC 80 MHz long GI IP 192.168.1.12.60225 > 130.211.14.80.443: Flags [.], ack 2909, win 1001, options [nop,nop,TS val 1202591822 ecr 2415923885], length 0
   93  15:59:32.654314 2902477033us tsft -83dBm noise antenna 1 5785 MHz 11a ht/20 User 0 MCS 8 LDPC FEC 80 MHz long GI IP 192.168.1.12.60225 > 130.211.14.80.443: Flags [.], ack 4219, win 991, options [nop,nop,TS val 1202591822 ecr 2415923886], length 0
   94  15:59:32.654388 2902477033us tsft -83dBm noise antenna 1 5785 MHz 11a ht/20 User 0 MCS 8 LDPC FEC 80 MHz long GI IP 192.168.1.12.60225 > 130.211.14.80.443: Flags [.], ack 5637, win 979, options [nop,nop,TS val 1202591822 ecr 2415923887], length 0
   95  15:59:32.654464 2902477033us tsft -83dBm noise antenna 1 5785 MHz 11a ht/20 User 0 MCS 8 LDPC FEC 80 MHz long GI IP 192.168.1.12.60225 > 130.211.14.80.443: Flags [.], ack 7055, win 968, options [nop,nop,TS val 1202591822 ecr 2415923888], length 0
   96  15:59:32.654539 2902477033us tsft -83dBm noise antenna 1 5785 MHz 11a ht/20 User 0 MCS 8 LDPC FEC 80 MHz long GI IP 192.168.1.12.60225 > 130.211.14.80.443: Flags [.], ack 8574, win 957, options [nop,nop,TS val 1202591822 ecr 2415923888], length 0
   97  15:59:32.654614 2902477033us tsft -83dBm noise antenna 1 5785 MHz 11a ht/20 User 0 MCS 8 LDPC FEC 80 MHz long GI IP 192.168.1.12.60225 > 130.211.14.80.443: Flags [.], ack 9755, win 947, options [nop,nop,TS val 1202591822 ecr 2415923889], length 0
   98  15:59:32.654690 2902477033us tsft -54dBm signal -83dBm noise antenna 1 5785 MHz 11a ht/20 [|802.11]IP 192.168.1.12.60225 > 130.211.14.80.443: Flags [.], ack 9755, win 1024, options [nop,nop,TS val 1202591822 ecr 2415923889], length 0
   99  15:59:32.655050 2902477277us tsft -83dBm noise antenna 1 5785 MHz 11a ht/20 User 0 MCS 8 LDPC FEC 80 MHz long GI IP 192.168.1.12.60225 > 130.211.14.80.443: Flags [.], ack 73, win 1023, options [nop,nop,TS val 1202591822 ecr 2415923885], length 0
  100  15:59:32.655125 2902477277us tsft -83dBm noise antenna 1 5785 MHz 11a ht/20 User 0 MCS 8 LDPC FEC 80 MHz long GI IP 192.168.1.12.60225 > 130.211.14.80.443: Flags [.], ack 1491, win 1012, options [nop,nop,TS val 1202591822 ecr 2415923885], length 0
  101  15:59:32.655200 2902477277us tsft -83dBm noise antenna 1 5785 MHz 11a ht/20 User 0 MCS 8 LDPC FEC 80 MHz long GI IP 192.168.1.12.60225 > 130.211.14.80.443: Flags [.], ack 2909, win 1001, options [nop,nop,TS val 1202591822 ecr 2415923885], length 0
  102  15:59:32.655275 2902477277us tsft bad-fcs -83dBm noise antenna 1 5785 MHz 11a ht/20 User 0 MCS 8 LDPC FEC 80 MHz long GI IP 192.168.1.12.60225 > 130.211.14.81.443: Flags [P.], ack 2313649826, win 859, options [nop,nop,TS val 1202591822 ecr 2415923886], length 0
  103  15:59:32.655349 2902477277us tsft -83dBm noise antenna 1 5785 MHz 11a ht/20 User 0 MCS 8 LDPC FEC 80 MHz long GI IP 192.168.1.12.60225 > 130.211.14.80.443: Flags [.], ack 5637, win 979, options [nop,nop,TS val 1202591822 ecr 2415923887], length 0
  104  15:59:32.655493 2902477277us tsft -83dBm noise antenna 1 5785 MHz 11a ht/20 User 0 MCS 8 LDPC FEC 80 MHz long GI IP 192.168.1.12.60225 > 130.211.14.80.443: Flags [.], ack 7055, win 968, options [nop,nop,TS val 1202591822 ecr 2415923888], length 0
  105  15:59:32.655568 2902477277us tsft -83dBm noise antenna 1 5785 MHz 11a ht/20 User 0 MCS 8 LDPC FEC 80 MHz long GI IP 192.168.1.12.60225 > 130.211.14.80.443: Flags [.], ack 8574, win 957, options [nop,nop,TS val 1202591822 ecr 2415923888], length 0
  106  15:59:32.655643 2902477277us tsft -54dBm signal -83dBm noise antenna 1 5785 MHz 11a ht/20 [|802.11]IP 192.168.1.12.60225 > 130.211.14.80.443: Flags [.], ack 9755, win 947, options [nop,nop,TS val 1202591822 ecr 2415923889], length 0
  107  15:59:32.655867 2902477521us tsft -83dBm noise antenna 1 5785 MHz 11a ht/20 User 0 MCS 8 LDPC FEC 80 MHz long GI IP 192.168.1.12.60225 > 130.211.14.80.443: Flags [.], ack 73, win 1023, options [nop,nop,TS val 1202591822 ecr 2415923885], length 0
  108  15:59:32.655941 2902477521us tsft -83dBm noise antenna 1 5785 MHz 11a ht/20 User 0 MCS 8 LDPC FEC 80 MHz long GI IP 192.168.1.12.60225 > 130.211.14.80.443: Flags [.], ack 1491, win 1012, options [nop,nop,TS val 1202591822 ecr 2415923885], length 0
  109  15:59:32.656016 2902477521us tsft -83dBm noise antenna 1 5785 MHz 11a ht/20 User 0 MCS 8 LDPC FEC 80 MHz long GI IP 192.168.1.12.60225 > 130.211.14.80.443: Flags [.], ack 2909, win 1001, options [nop,nop,TS val 1202591822 ecr 2415923885], length 0
  110  15:59:32.656090 2902477521us tsft -83dBm noise antenna 1 5785 MHz 11a ht/20 User 0 MCS 8 LDPC FEC 80 MHz long GI IP 192.168.1.12.60225 > 130.211.14.80.443: Flags [.], ack 4219, win 991, options [nop,nop,TS val 1202591822 ecr 2415923886], length 0
  111  15:59:32.656165 2902477521us tsft -83dBm noise antenna 1 5785 MHz 11a ht/20 User 0 MCS 8 LDPC FEC 80 MHz long GI IP 192.168.1.12.60225 > 130.211.14.80.443: Flags [.], ack 5637, win 979, options [nop,nop,TS val 1202591822 ecr 2415923887], length 0
  112  15:59:32.656239 2902477521us tsft -83dBm noise antenna 1 5785 MHz 11a ht/20 User 0 MCS 8 LDPC FEC 80 MHz long GI IP 192.168.1.12.60225 > 130.211.14.80.443: Flags [.], ack 7055, win 968, options [nop,nop,TS val 1202591822 ecr 2415923888], length 0
  113  15:59:32.656314 2902477521us tsft -83dBm noise antenna 1 5785 MHz 11a ht/20 User 0 MCS 8 LDPC FEC 80 MHz long GI IP 192.168.1.12.60225 > 130.211.14.80.443: Flags [.], ack 8574, win 957, options [nop,nop,TS val 1202591822 ecr 2415923888], length 0
  114  15:59:32.656388 2902477521us tsft -83dBm noise antenna 1 5785 MHz 11a ht/20 User 0 MCS 8 LDPC FEC 80 MHz long GI IP 192.168.1.12.60225 > 130.211.14.80.443: Flags [.], ack 9755, win 947, options [nop,nop,TS val 1202591822 ecr 2415923889], length 0
  115  15:59:32.656463 2902477521us tsft -54dBm signal -83dBm noise antenna 1 5785 MHz 11a ht/20 [|802.11]IP 192.168.1.12.60225 > 130.211.14.80.443: Flags [.], ack 9755, win 1024, options [nop,nop,TS val 1202591822 ecr 2415923889], length 0
  116  15:59:32.656687 2902477802us tsft -83dBm noise antenna 1 5785 MHz 11a ht/20 User 0 MCS 6 LDPC FEC 80 MHz long GI IP 192.168.1.12.60225 > 130.211.14.80.443: Flags [.], ack 73, win 1023, options [nop,nop,TS val 1202591822 ecr 2415923885], length 0
  117  15:59:32.656761 2902477802us tsft -83dBm noise antenna 1 5785 MHz 11a ht/20 User 0 MCS 6 LDPC FEC 80 MHz long GI IP 192.168.1.12.60225 > 130.211.14.80.443: Flags [.], ack 1491, win 1012, options [nop,nop,TS val 1202591822 ecr 2415923885], length 0
  118  15:59:32.656835 2902477802us tsft -83dBm noise antenna 1 5785 MHz 11a ht/20 User 0 MCS 6 LDPC FEC 80 MHz long GI IP 192.168.1.12.60225 > 130.211.14.80.443: Flags [.], ack 2909, win 1001, options [nop,nop,TS val 1202591822 ecr 2415923885], length 0
  119  15:59:32.656910 2902477802us tsft -83dBm noise antenna 1 5785 MHz 11a ht/20 User 0 MCS 6 LDPC FEC 80 MHz long GI IP 192.168.1.12.60225 > 130.211.14.80.443: Flags [.], ack 4219, win 991, options [nop,nop,TS val 1202591822 ecr 2415923886], length 0
  120  15:59:32.656983 2902477802us tsft -83dBm noise antenna 1 5785 MHz 11a ht/20 User 0 MCS 6 LDPC FEC 80 MHz long GI IP 192.168.1.12.60225 > 130.211.14.80.443: Flags [.], ack 5637, win 979, options [nop,nop,TS val 1202591822 ecr 2415923887], length 0
  121  15:59:32.657057 2902477802us tsft -83dBm noise antenna 1 5785 MHz 11a ht/20 User 0 MCS 6 LDPC FEC 80 MHz long GI IP 192.168.1.12.60225 > 130.211.14.80.443: Flags [.], ack 7055, win 968, options [nop,nop,TS val 1202591822 ecr 2415923888], length 0
  122  15:59:32.657132 2902477802us tsft -83dBm noise antenna 1 5785 MHz 11a ht/20 User 0 MCS 6 LDPC FEC 80 MHz long GI IP 192.168.1.12.60225 > 130.211.14.80.443: Flags [.], ack 8574, win 957, options [nop,nop,TS val 1202591822 ecr 2415923888], length 0
  123  15:59:32.657206 2902477802us tsft -83dBm noise antenna 1 5785 MHz 11a ht/20 User 0 MCS 6 LDPC FEC 80 MHz long GI IP 192.168.1.12.60225 > 130.211.14.80.443: Flags [.], ack 9755, win 947, options [nop,nop,TS val 1202591822 ecr 2415923889], length 0
  124  15:59:32.657281 2902477802us tsft -52dBm signal -83dBm noise antenna 1 5785 MHz 11a ht/20 [|802.11]IP 192.168.1.12.60225 > 130.211.14.80.443: Flags [.], ack 9755, win 1024, options [nop,nop,TS val 1202591822 ecr 2415923889], length 0
  125  15:59:32.657578 2902478222us tsft -83dBm noise antenna 1 5785 MHz 11a ht/20 User 0 MCS 8 LDPC FEC 80 MHz long GI IP 192.168.1.12.60225 > 130.211.14.80.443: Flags [.], ack 9755, win 1024, options [nop,nop,TS val 1202591824 ecr 2415924175], length 0
  126  15:59:32.657653 2902478222us tsft -54dBm signal -83dBm noise antenna 1 5785 MHz 11a ht/20 [|802.11]IP 192.168.1.12.60225 > 130.211.14.80.443: Flags [P.], seq 1700:1746, ack 9755, win 1024, options [nop,nop,TS val 1202591824 ecr 2415924175], length 46
  127  15:59:32.657949 2902478438us tsft -83dBm noise antenna 1 5785 MHz 11a ht/20 User 0 MCS 8 LDPC FEC 80 MHz long GI IP 192.168.1.12.60225 > 130.211.14.80.443: Flags [.], ack 9755, win 1024, options [nop,nop,TS val 1202591824 ecr 2415924175], length 0
  128  15:59:32.658024 2902478438us tsft -54dBm signal -83dBm noise antenna 1 5785 MHz 11a ht/20 [|802.11]IP 192.168.1.12.60225 > 130.211.14.80.443: Flags [P.], seq 1700:1746, ack 9755, win 1024, options [nop,nop,TS val 1202591824 ecr 2415924175], length 46
  129  15:59:32.658247 2902478654us tsft -83dBm noise antenna 1 5785 MHz 11a ht/20 User 0 MCS 8 LDPC FEC 80 MHz long GI IP 192.168.1.12.60225 > 130.211.14.80.443: Flags [.], ack 9755, win 1024, options [nop,nop,TS val 1202591824 ecr 2415924175], length 0
  130  15:59:32.658322 2902478654us tsft -54dBm signal -83dBm noise antenna 1 5785 MHz 11a ht/20 [|802.11]IP 192.168.1.12.60225 > 130.211.14.80.443: Flags [P.], seq 1700:1746, ack 9755, win 1024, options [nop,nop,TS val 1202591824 ecr 2415924175], length 46
  131  15:59:32.658549 2902478888us tsft -83dBm noise antenna 1 5785 MHz 11a ht/20 User 0 MCS 6 LDPC FEC 80 MHz long GI IP 192.168.1.12.60225 > 130.211.14.80.443: Flags [.], ack 9755, win 1024, options [nop,nop,TS val 1202591824 ecr 2415924175], length 0
  132  15:59:32.658624 2902478888us tsft -52dBm signal -83dBm noise antenna 1 5785 MHz 11a ht/20 [|802.11]IP 192.168.1.12.60225 > 130.211.14.80.443: Flags [P.], seq 1700:1746, ack 9755, win 1024, options [nop,nop,TS val 1202591824 ecr 2415924175], length 46
  133  15:59:32.745896 2902568834us tsft -64dBm signal -83dBm noise antenna 1 5785 MHz 11a ht/20 [|802.11]IP 130.211.14.80.443 > 192.168.1.12.60225: Flags [.], ack 1746, win 4524, options [nop,nop,TS val 2415924434 ecr 1202591824], length 0
  134  15:59:33.046323 2902869453us tsft bad-fcs -54dBm signal -83dBm noise antenna 1 5785 MHz 11a ht/20 [|802.11]IP 192.168.1.12.60225 > 130.211.14.80.443: Flags [P.], seq 3000:3470, ack 9755, win 1024, options [nop,nop,TS val 1202592190 ecr 2415924434], length 470
  135  15:59:33.046596 2902869676us tsft -54dBm signal -83dBm noise antenna 1 5785 MHz 11a ht/20 [|802.11]IP 192.168.1.12.60225 > 130.211.14.80.443: Flags [P.], seq 3000:3470, ack 9755, win 1024, options [nop,nop,TS val 1202592190 ecr 2415924434], length 470
  136  15:59:33.412617 2903235306us tsft -53dBm signal -83dBm noise antenna 1 5785 MHz 11a ht/20 [|802.11]IP 192.168.1.15.55741 > 130.211.14.80.443: Flags [P.], seq 2680689469:2680689746, ack 3244485065, win 1024, options [nop,nop,TS val 1155057148 ecr 577149039], length 277
  137  15:59:33.932809 2903755652us tsft -46dBm signal -83dBm noise antenna 1 5785 MHz 11a ht/20 [|802.11]IP 192.168.1.14.64122 > 17.134.127.249.443: Flags [SEW], seq 437881844, win 65535, options [mss 1460,nop,wscale 5,nop,nop,TS val 2250505392 ecr 0,sackOK,eol], length 0
  138  15:59:34.087340 2903910352us tsft -52dBm signal -83dBm noise antenna 1 5785 MHz 11a ht/20 [|802.11]IP 192.168.1.12.60225 > 130.211.14.80.443: Flags [.], seq 1746:2934, ack 9755, win 1024, options [nop,nop,TS val 1202593253 ecr 2415925197], length 1188
  139  15:59:34.292796 2904115962us tsft -46dBm signal -83dBm noise antenna 1 5785 MHz 11a ht/20 [|802.11]IP 192.168.1.14.64122 > 17.134.127.249.443: Flags [.], ack 3223108826, win 8192, length 0
  140  15:59:34.298334 2904121320us tsft -46dBm signal -83dBm noise antenna 1 5785 MHz 11a ht/20 [|802.11]IP 192.168.1.14.64122 > 17.134.127.249.443: Flags [P.], seq 0:237, ack 1, win 8192, length 237
  141  15:59:34.494085 2904316965us tsft -63dBm signal -83dBm noise antenna 1 5785 MHz 11a ht/20 [|802.11]IP 130.211.14.80.443 > 192.168.1.12.60225: Flags [.], ack 2934, win 4520, options [nop,nop,TS val 2415925874 ecr 1202593253,nop,nop,sack 1 {3000:3470}], length 0
  142  15:59:34.497499 2904320406us tsft -53dBm signal -83dBm noise antenna 1 5785 MHz 11a ht/20 [|802.11]IP 192.168.1.12.60225 > 130.211.14.80.443: Flags [.], seq 2934:3000, ack 9755, win 1024, options [nop,nop,TS val 1202593662 ecr 2415925874], length 66
  143  15:59:34.699323 2904522306us tsft -83dBm noise antenna 1 5785 MHz 11a ht/20 User 0 MCS 6 LDPC FEC 80 MHz long GI IP 17.134.127.249.443 > 192.168.1.14.64122: Flags [.], ack 237, win 256, length 0
  144  15:59:34.699408 2904522306us tsft -83dBm noise antenna 1 5785 MHz 11a ht/20 User 0 MCS 6 LDPC FEC 80 MHz long GI IP 17.134.127.249.443 > 192.168.1.14.64122: Flags [.], seq 1:1461, ack 237, win 256, length 1460
  145  15:59:34.699484 2904522306us tsft -83dBm noise antenna 1 5785 MHz 11a ht/20 User 0 MCS 6 LDPC FEC 80 MHz long GI IP 17.134.127.249.443 > 192.168.1.14.64122: Flags [P.], seq 1461:2842, ack 237, win 256, length 1381
  146  15:59:34.699561 2904522306us tsft -56dBm signal -83dBm noise antenna 1 5785 MHz 11a ht/20 [|802.11]IP 17.134.127.249.443 > 192.168.1.14.64122: Flags [P.], seq 1461:2842, ack 237, win 256, length 1381
  147  15:59:34.701943 2904524854us tsft -83dBm noise antenna 1 5785 MHz 11a ht/20 User 0 MCS 9 LDPC FEC 80 MHz long GI IP 192.168.1.14.64122 > 17.134.127.249.443: Flags [.], ack 2842, win 8103, length 0
  148  15:59:34.702056 2904524854us tsft -44dBm signal -83dBm noise antenna 1 5785 MHz 11a ht/20 [|802.11]IP 192.168.1.14.64122 > 17.134.127.249.443: Flags [.], ack 2842, win 8103, options [nop,nop,sack 1 {1461:2842}], length 0
  149  15:59:34.743118 2904566034us tsft bad-fcs -56dBm signal -83dBm noise antenna 1 5785 MHz 11a ht/20 [|802.11]e4:18:6b:dc:70:9b Unknown SSAP 0x8a > 9c:f4:8e:2e:25:b5 Unknown DSAP 0xea Unnumbered, 07, Flags [Command], length 1508
	0x0000:  ea8a 0700 0008 0800 4500 05dc 7c24 4000  ........E...|$@.
	0x0010:  f106 bcc1 1186 7ef9 c0a8 010e 81fb fe7a  ......~........z
	0x0020:  c31d bcda 1a11 0ca8 5010 0104 0df7 0004  ........P.......
	0x0030:  1603 0300 5f02 0000 5b03 035d 904d 66a2  ...._...[..].Mf.
	0x0040:  5c28 e60a 925b 7d2c daeb aa22 a4f7 0338  \(...[},..."...8
	0x0050:  243b 76af eddf 8ee4 db17 dd20 62fc c661  $;v.........b..a
	0x0060:  4e64 f65c 4217 8cee e6d8 b885 c8e9 3b5a  Nd.\B.........;Z
	0x0070:  a465 7130 d838 4ae1 5f0f 2ca0 c02c 0000  .eq0.8J._.,..,..
	0x0080:  1300 0000 0000 1700 00ff 0100 0904 000b  ................
	0x0090:  0002 0100 1603 030a 0e0b 5003 8a02 0a07  ..........P.....
	0x00a0:  0006 b930 a204 a5b0 8206 4aa0 0302 4582  ...0......J...E.
	0x00b0:  4a91 43f4 dcfb 45e2 49ed 4d3a e912 3931  J.C...E.I.M:..91
	0x00c0:  54a3 300a 0608 2a86 49ce 3d04 0306 3862  T.0...*.I.=...8b
	0x00d0:  1118 301a 2603 5524 0b18 1a41 78f0 6c65  ..0.&.U$...Ax.le
	0x00e0:  2049 5354 2043 4120 3820 2d20 4731 7120  .IST.CA.8.-.G1q.
	0x00f0:  301e 0603 554c 0b0c 1743 7532 7569 2a69  0...UL...Cu2ui*i
	0x0100:  6361 746b 676e 2045 3564 686f 7269 7479  catkgn.E5dhority
	0x0110:  3113 3011 0603 5504 2a0d 0a41 7070 6c65  1.0...U.*..Apple
	0x0120:  2249 6f63 0e70 4a31 1d94 0255 0406 1302  "Ioc.pJ1...U....
	0x0130:  5553 303e 170d 3139 3033 3238 3137 3534  US0>..1903281754
	0x0140:  1536 5a15 0d32 1030 3431 3831 3830 3470  .6Z..2.04181804p
	0x0150:  305a 3052 3119 3017 0203 5504 818c 1067  0Z0R1.0...U....g
	0x0160:  5b04 6c6f 632f 6170 706c 652f 636e 2d39  [.loc/apple/cn-9
	0x0170:  1330 1106 0355 040a 0c4a 4150 70ec 7420  .0...U...JAPp.t.
	0x0180:  4b4e 632e 9113 3811 0631 4500 080c 0a43  KNc...8..1E....C
	0x0190:  616c 6966 6f32 6e69 6131 0b30 0906 1357  alifo2nia1.0...W
	0x01a0:  0506 1302 5553 3059 3013 0607 0a84 48ce  ....US0Y0.....H.
	0x01b0:  3d82 0146 082a 8648 ce3d 0301 0703 4200  =..F.*.H.=....B.
	0x01c0:  043e fbce 0ff1 e6ed 22a9 49df 7a66 892f  .>......".I.zf./
	0x01d0:  7eab 5fb0 bc2d 9a4a c5b4 3117 27bd 7b06  ~._..-.J..1.'.{.
	0x01e0:  0567 7bee d061 25b1 d6d4 f955 1e1e 3b9e  .g{..a%....U..;.
	0x01f0:  6dfd da96 442f ea97 7c33 16c4 1245 6673  m...D/..|3...Efs
	0x0200:  20a3 a204 f130 c204 ed30 0816 0315 0d12  .....0...0......
	0x0210:  0105 ffa6 0230 0030 1706 0355 1d23 0418  .....0.0...U.#..
