    1  15:46:21.857134 2111688821us tsft -92dBm noise antenna 1 5785 MHz 11a ht/20 User 0 MCS 6 LDPC FEC 80 MHz long GI IP 203.104.153.6.443 > 192.168.1.15.55654: Flags [.], ack 245094201, win 370, options [nop,nop,TS val 138303569 ecr 1153909373,nop,nop,sack 1 {7129:11881}], length 0
    2  15:46:21.857223 2111688821us tsft -92dBm noise antenna 1 5785 MHz 11a ht/20 User 0 MCS 6 LDPC FEC 80 MHz long GI IP 203.104.153.6.443 > 192.168.1.15.55654: Flags [.], ack 1, win 370, options [nop,nop,TS val 138303590 ecr 1153909373,nop,nop,sack 1 {7129:13069}], length 0
    3  15:46:21.857300 2111688821us tsft -57dBm signal -92dBm noise antenna 1 5785 MHz 11a ht/20 [|802.11]IP 203.104.153.6.443 > 192.168.1.15.55654: Flags [.], ack 1, win 370, options [nop,nop,TS val 138303600 ecr 1153909373,nop,nop,sack 1 {7129:14257}], length 0
    4  15:46:21.968303 2111799971us tsft -57dBm signal -92dBm noise antenna 1 5785 MHz 11a ht/20 [|802.11]IP 203.104.153.6.443 > 192.168.1.15.55654: Flags [.], ack 1, win 370, options [nop,nop,TS val 138303714 ecr 1153909373,nop,nop,sack 1 {7129:21385}], length 0
    5  15:46:22.003492 2111835266us tsft -36dBm signal -92dBm noise antenna 1 5785 MHz 11a ht/20 [|802.11]IP 192.168.1.15.55654 > 203.104.153.6.443: Flags [.], seq 1:1189, ack 0, win 1024, options [nop,nop,TS val 1153910475 ecr 138303714], length 1188
    6  15:46:22.005105 2111836934us tsft -92dBm noise antenna 1 5785 MHz 11a ht/20 User 0 MCS 7 LDPC FEC 80 MHz short GI IP 203.104.153.6.443 > 192.168.1.15.55654: Flags [.], ack 1, win 370, options [nop,nop,TS val 138303737 ecr 1153909373,nop,nop,sack 1 {7129:22573}], length 0
    7  15:46:22.005212 2111836934us tsft bad-fcs -57dBm signal -92dBm noise antenna 1 5785 MHz 11a ht/20 [|802.11]IP 203.104.153.6.443 > 192.168.1.15.55654:  tcp 36 [bad hdr length 8 - too short, < 20]
    8  15:46:22.059254 2111889246us tsft -92dBm noise antenna 1 5785 MHz 11a ht/20 User 0 MCS 0 LDPC FEC 80 MHz (UL) long GI IP 192.168.1.15.55654 > 203.104.153.6.443: Flags [.], seq 1189:2377, ack 0, win 1024, options [nop,nop,TS val 1153910484 ecr 138303737], length 1188
    9  15:46:22.060707 2111889246us tsft -35dBm signal -92dBm noise antenna 1 5785 MHz 11a ht/20 [|802.11]IP 192.168.1.15.55654 > 203.104.153.6.443: Flags [.], seq 2377:3565, ack 0, win 1024, options [nop,nop,TS val 1153910485 ecr 138303746], length 1188
   10  15:46:22.062815 2111894545us tsft -92dBm noise antenna 1 5785 MHz 11a ht/20 User 0 MCS 7 LDPC FEC 80 MHz short GI IP 203.104.153.6.443 > 192.168.1.15.55654: Flags [.], ack 1, win 370, options [nop,nop,TS val 138303770 ecr 1153909373,nop,nop,sack 1 {7129:24949}], length 0
   11  15:46:22.062922 2111894545us tsft -92dBm noise antenna 1 5785 MHz 11a ht/20 User 0 MCS 7 LDPC FEC 80 MHz short GI IP 203.104.153.6.443 > 192.168.1.15.55654: Flags [.], ack 1, win 370, options [nop,nop,TS val 138303773 ecr 1153909373,nop,nop,sack 1 {7129:26137}], length 0
   12  15:46:22.062998 2111894545us tsft -92dBm noise antenna 1 5785 MHz 11a ht/20 User 0 MCS 7 LDPC FEC 80 MHz short GI IP 203.104.153.6.443 > 192.168.1.15.55654: Flags [.], ack 1, win 370, options [nop,nop,TS val 138303787 ecr 1153909373,nop,nop,sack 1 {7129:27325}], length 0
   13  15:46:22.063074 2111894545us tsft -58dBm signal -92dBm noise antenna 1 5785 MHz 11a ht/20 [|802.11]IP 203.104.153.6.443 > 192.168.1.15.55654: Flags [.], ack 1, win 370, options [nop,nop,TS val 138303804 ecr 1153909373,nop,nop,sack 1 {7129:28513}], length 0
   14  15:46:22.067226 2111899012us tsft -92dBm noise antenna 1 5785 MHz 11a ht/20 User 0 MCS 4 LDPC FEC 80 MHz short GI IP 192.168.1.15.55654 > 203.104.153.6.443: Flags [.], seq 3565:4753, ack 0, win 1024, options [nop,nop,TS val 1153910542 ecr 138303770], length 1188
   15  15:46:22.067331 2111899012us tsft -92dBm noise antenna 1 5785 MHz 11a ht/20 User 0 MCS 4 LDPC FEC 80 MHz short GI IP 192.168.1.15.55654 > 203.104.153.6.443: Flags [.], seq 4753:5941, ack 0, win 1024, options [nop,nop,TS val 1153910542 ecr 138303773], length 1188
   16  15:46:22.067404 2111899012us tsft -92dBm noise antenna 1 5785 MHz 11a ht/20 User 0 MCS 4 LDPC FEC 80 MHz short GI IP 192.168.1.15.55654 > 203.104.153.6.443: Flags [.], seq 5941:7129, ack 0, win 1024, options [nop,nop,TS val 1153910542 ecr 138303787], length 1188
   17  15:46:22.067539 2111899012us tsft -37dBm signal -92dBm noise antenna 1 5785 MHz 11a ht/20 [|802.11]IP 192.168.1.15.55654 > 203.104.153.6.443: Flags [.], seq 43957:45145, ack 0, win 1024, options [nop,nop,TS val 1153910542 ecr 138303804], length 1188
   18  15:46:22.106768 2111938475us tsft -92dBm noise antenna 1 5785 MHz 11a ht/20 User 0 MCS 7 LDPC FEC 80 MHz short GI IP 203.104.153.6.443 > 192.168.1.15.55654: Flags [.], ack 1, win 370, options [nop,nop,TS val 138303842 ecr 1153909373,nop,nop,sack 1 {7129:29701}], length 0
   19  15:46:22.106853 2111938475us tsft -58dBm signal -92dBm noise antenna 1 5785 MHz 11a ht/20 [|802.11]IP 203.104.153.6.443 > 192.168.1.15.55654: Flags [.], ack 1, win 370, options [nop,nop,TS val 138303842 ecr 1153909373,nop,nop,sack 1 {7129:30889}], length 0
   20  15:46:22.159085 2111990830us tsft -92dBm noise antenna 1 5785 MHz 11a ht/20 User 0 MCS 4 LDPC FEC 80 MHz (UL) short GI IP 192.168.1.15.55654 > 203.104.153.6.443: Flags [.], seq 45145:46333, ack 0, win 1024, options [nop,nop,TS val 1153910584 ecr 138303842], length 1188
   21  15:46:22.159190 2111990830us tsft -36dBm signal -92dBm noise antenna 1 5785 MHz 11a ht/20 [|802.11]IP 192.168.1.15.55654 > 203.104.153.6.443: Flags [.], seq 46333:47521, ack 0, win 1024, options [nop,nop,TS val 1153910584 ecr 138303842], length 1188
   22  15:46:22.160753 2111992336us tsft bad-fcs -57dBm signal -92dBm noise antenna 1 5785 MHz 11a ht/20 [|802.11]IP 203.104.153.6.16795 > 192.168.1.15.65444: Flags [.], ack 37416504, win 370, options [nop,nop,TS val 138303901 ecr 1153909373,nop,nop,sack 2 {207187862:2619219159}{1770049062:983916970}], length 0
   23  15:46:22.162063 2111993715us tsft -92dBm noise antenna 1 5785 MHz 11a ht/20 User 0 MCS 6 LDPC FEC 80 MHz long GI IP 203.104.153.6.443 > 192.168.1.15.55654: Flags [.], ack 1, win 370, options [nop,nop,TS val 138303891 ecr 1153909373,nop,nop,sack 2 {34453:36829}{7129:30889}], length 0
   24  15:46:22.162171 2111993715us tsft -54dBm signal -92dBm noise antenna 1 5785 MHz 11a ht/20 [|802.11]IP 203.104.153.6.443 > 192.168.1.15.55654: Flags [.], ack 1, win 370, options [nop,nop,TS val 138303901 ecr 1153909373,nop,nop,sack 2 {34453:38017}{7129:30889}], length 0
   25  15:46:22.162956 2111994594us tsft -92dBm noise antenna 1 5785 MHz 11a ht/20 User 0 MCS 4 LDPC FEC 80 MHz short GI IP 192.168.1.15.55654 > 203.104.153.6.443: Flags [.], seq 30889:32077, ack 0, win 1024, options [nop,nop,TS val 1153910637 ecr 138303875], length 1188
   26  15:46:22.163044 2111994594us tsft -92dBm noise antenna 1 5785 MHz 11a ht/20 User 0 MCS 4 LDPC FEC 80 MHz short GI IP 192.168.1.15.55654 > 203.104.153.6.443: Flags [.], seq 32077:33265, ack 0, win 1024, options [nop,nop,TS val 1153910637 ecr 138303875], length 1188
   27  15:46:22.163120 2111994594us tsft -38dBm signal -92dBm noise antenna 1 5785 MHz 11a ht/20 [|802.11]IP 192.168.1.15.55654 > 203.104.153.6.443: Flags [.], seq 33265:34453, ack 0, win 1024, options [nop,nop,TS val 1153910637 ecr 138303875], length 1188
   28  15:46:22.169092 2112000716us tsft -54dBm signal -92dBm noise antenna 1 5785 MHz 11a ht/20 [|802.11]IP 203.104.153.6.443 > 192.168.1.15.55654: Flags [.], ack 1, win 370, options [nop,nop,TS val 138303916 ecr 1153909373,nop,nop,sack 2 {34453:39205}{7129:30889}], length 0
   29  15:46:22.171812 2112003433us tsft -37dBm signal -92dBm noise antenna 1 5785 MHz 11a ht/20 [|802.11]IP 192.168.1.15.55654 > 203.104.153.6.443: Flags [.], seq 47521:48709, ack 0, win 1024, options [nop,nop,TS val 1153910644 ecr 138303916], length 1188
   30  15:46:22.211196 2112043066us tsft -92dBm noise antenna 1 5785 MHz 11a ht/20 User 0 MCS 4 LDPC FEC 80 MHz short GI IP 192.168.1.15.55654 > 203.104.153.6.443: Flags [.], seq 48709:49897, ack 0, win 1024, options [nop,nop,TS val 1153910683 ecr 138303927], length 1188
   31  15:46:22.211356 2112043066us tsft -92dBm noise antenna 1 5785 MHz 11a ht/20 User 0 MCS 4 LDPC FEC 80 MHz short GI IP 192.168.1.15.55654 > 203.104.153.6.443: Flags [.], seq 49897:51085, ack 0, win 1024, options [nop,nop,TS val 1153910683 ecr 138303942], length 1188
   32  15:46:22.211431 2112043066us tsft -36dBm signal -92dBm noise antenna 1 5785 MHz 11a ht/20 [|802.11]IP 192.168.1.15.55654 > 203.104.153.6.443: Flags [.], seq 51085:52273, ack 0, win 1024, options [nop,nop,TS val 1153910683 ecr 138303947], length 1188
   33  15:46:22.219246 2112050982us tsft -36dBm signal -92dBm noise antenna 1 5785 MHz 11a ht/20 [|802.11]IP 192.168.1.15.55654 > 203.104.153.6.443: Flags [.], seq 52273:53461, ack 0, win 1024, options [nop,nop,TS val 1153910691 ecr 138303963], length 1188
   34  15:46:22.224708 2112056520us tsft -38dBm signal -92dBm noise antenna 1 5785 MHz 11a ht/20 [|802.11]IP 192.168.1.15.55654 > 203.104.153.6.443: Flags [.], seq 53461:54649, ack 0, win 1024, options [nop,nop,TS val 1153910696 ecr 138303968], length 1188
   35  15:46:22.225553 2112057312us tsft -47dBm signal -92dBm noise antenna 1 5785 MHz 11a ht/20 [|802.11]IP 192.168.1.14.64027 > 130.211.14.80.443: Flags [.], ack 671126999, win 4096, length 0
   36  15:46:22.227497 2112059195us tsft -48dBm signal -92dBm noise antenna 1 5785 MHz 11a ht/20 [|802.11]IP 192.168.1.12.60271 > 130.211.14.80.443: Flags [.], ack 2535209562, win 1022, options [nop,nop,TS val 1201802431 ecr 2415133943], length 0
   37  15:46:22.229003 2112060702us tsft -92dBm noise antenna 1 5785 MHz 11a ht/20 User 0 MCS 5 LDPC FEC 80 MHz long GI IP 192.168.1.14.63881 > 130.211.14.80.443: Flags [.], ack 3072207326, win 4093, options [nop,nop,TS val 2249715474 ecr 1736074033], length 0
   38  15:46:22.229091 2112060702us tsft -92dBm noise antenna 1 5785 MHz 11a ht/20 User 0 MCS 5 LDPC FEC 80 MHz long GI IP 192.168.1.14.63881 > 130.211.14.80.443: Flags [.], ack 1419, win 4049, options [nop,nop,TS val 2249715474 ecr 1736074033], length 0
   39  15:46:22.229166 2112060702us tsft -92dBm noise antenna 1 5785 MHz 11a ht/20 User 0 MCS 5 LDPC FEC 80 MHz long GI IP 192.168.1.14.63881 > 130.211.14.80.443: Flags [.], ack 2837, win 4096, options [nop,nop,TS val 2249715474 ecr 1736074033], length 0
   40  15:46:22.229241 2112060702us tsft -92dBm noise antenna 1 5785 MHz 11a ht/20 User 0 MCS 5 LDPC FEC 80 MHz long GI IP 192.168.1.14.63881 > 130.211.14.80.443: Flags [.], ack 4044, win 4058, options [nop,nop,TS val 2249715474 ecr 1736074033], length 0
   41  15:46:22.229316 2112060702us tsft -92dBm noise antenna 1 5785 MHz 11a ht/20 User 0 MCS 5 LDPC FEC 80 MHz long GI IP 192.168.1.14.63881 > 130.211.14.80.443: Flags [.], ack 5462, win 4013, options [nop,nop,TS val 2249715474 ecr 1736074039], length 0
   42  15:46:22.229391 2112060702us tsft -92dBm noise antenna 1 5785 MHz 11a ht/20 User 0 MCS 5 LDPC FEC 80 MHz long GI IP 192.168.1.14.63881 > 130.211.14.80.443: Flags [.], ack 8071, win 3932, options [nop,nop,TS val 2249715474 ecr 1736074040], length 0
   43  15:46:22.229467 2112060702us tsft -47dBm signal -92dBm noise antenna 1 5785 MHz 11a ht/20 [|802.11]IP 192.168.1.14.63881 > 130.211.14.80.443: Flags [.], ack 8261, win 3926, options [nop,nop,TS val 2249715474 ecr 1736074041], length 0
   44  15:46:22.229618 2112060843us tsft -92dBm noise antenna 1 5785 MHz 11a ht/20 User 0 MCS 5 LDPC FEC 80 MHz long GI IP 192.168.1.14.63881 > 130.211.14.80.443: Flags [.], ack 8261, win 4096, options [nop,nop,TS val 2249715474 ecr 1736074041], length 0
   45  15:46:22.229693 2112060843us tsft -47dBm signal -92dBm noise antenna 1 5785 MHz 11a ht/20 [|802.11]IP 192.168.1.14.63881 > 130.211.14.80.443: Flags [P.], seq 0:46, ack 8261, win 4096, options [nop,nop,TS val 2249715474 ecr 1736074041], length 46
   46  15:46:22.230001 2112061077us tsft -92dBm noise antenna 1 5785 MHz 11a ht/20 User 0 MCS 5 LDPC FEC 80 MHz long GI IP 192.168.1.14.63881 > 130.211.14.80.443: Flags [.], ack 8261, win 4096, options [nop,nop,TS val 2249715474 ecr 1736074041], length 0
   47  15:46:22.230078 2112061077us tsft -47dBm signal -92dBm noise antenna 1 5785 MHz 11a ht/20 [|802.11]IP 192.168.1.14.63881 > 130.211.14.80.443: Flags [P.], seq 0:46, ack 8261, win 4096, options [nop,nop,TS val 2249715474 ecr 1736074041], length 46
   48  15:46:22.230304 2112061301us tsft -92dBm noise antenna 1 5785 MHz 11a ht/20 User 0 MCS 5 LDPC FEC 80 MHz long GI IP 192.168.1.14.63881 > 130.211.14.80.443: Flags [.], ack 8261, win 4096, options [nop,nop,TS val 2249715474 ecr 1736074041], length 0
   49  15:46:22.230379 2112061301us tsft -47dBm signal -92dBm noise antenna 1 5785 MHz 11a ht/20 [|802.11]IP 192.168.1.14.63881 > 130.211.14.80.443: Flags [P.], seq 0:46, ack 8261, win 4096, options [nop,nop,TS val 2249715474 ecr 1736074041], length 46
   50  15:46:22.230529 2112061427us tsft -47dBm signal -92dBm noise antenna 1 5785 MHz 11a ht/20 [|802.11]IP 192.168.1.14.63881 > 130.211.14.80.443: Flags [P.], seq 0:46, ack 8261, win 4096, options [nop,nop,TS val 2249715474 ecr 1736074041], length 46
   51  15:46:22.262351 2112094074us tsft -34dBm signal -92dBm noise antenna 1 5785 MHz 11a ht/20 [|802.11]IP 192.168.1.15.55654 > 203.104.153.6.443: Flags [.], seq 54649:55837, ack 0, win 1024, options [nop,nop,TS val 1153910704 ecr 138303977], length 1188
   52  15:46:22.263191 2112095008us tsft -92dBm noise antenna 1 5785 MHz 11a ht/20 User 0 MCS 6 LDPC FEC 80 MHz long GI IP 203.104.153.6.443 > 192.168.1.15.55654: Flags [.], ack 2377, win 370, options [nop,nop,TS val 138303987 ecr 1153910484,nop,nop,sack 3 {3565:4753}{34453:43957}{7129:30889}], length 0
   53  15:46:22.263321 2112095008us tsft -54dBm signal -92dBm noise antenna 1 5785 MHz 11a ht/20 [|802.11]IP 203.104.153.6.443 > 192.168.1.15.55654: Flags [.], ack 2377, win 370, options [nop,nop,TS val 138303996 ecr 1153910484,nop,nop,sack 3 {3565:5941}{34453:43957}{7129:30889}], length 0
   54  15:46:22.263472 2112095159us tsft -55dBm signal -92dBm noise antenna 1 5785 MHz 11a ht/20 [|802.11]IP 130.211.14.80.443 > 192.168.1.14.64027: Flags [.], ack 1, win 244, options [nop,nop,TS val 3035915180 ecr 2249714039], length 0
   55  15:46:22.264650 2112096536us tsft -92dBm noise antenna 1 5785 MHz 11a ht/20 User 0 MCS 7 LDPC FEC 80 MHz long GI IP 203.104.153.6.443 > 192.168.1.15.55654: Flags [.], ack 2377, win 370, options [nop,nop,TS val 138303999 ecr 1153910484,nop,nop,sack 2 {3565:30889}{34453:43957}], length 0
   56  15:46:22.264758 2112096536us tsft -92dBm noise antenna 1 5785 MHz 11a ht/20 User 0 MCS 7 LDPC FEC 80 MHz long GI IP 203.104.153.6.443 > 192.168.1.15.55654: Flags [.], ack 2377, win 370, options [nop,nop,TS val 138304004 ecr 1153910484,nop,nop,sack 2 {34453:45145}{3565:30889}], length 0
   57  15:46:22.264833 2112096536us tsft -92dBm noise antenna 1 5785 MHz 11a ht/20 User 0 MCS 7 LDPC FEC 80 MHz long GI IP 203.104.153.6.443 > 192.168.1.15.55654: Flags [.], ack 2377, win 370, options [nop,nop,TS val 138304008 ecr 1153910484,nop,nop,sack 2 {34453:46333}{3565:30889}], length 0
   58  15:46:22.264909 2112096536us tsft -57dBm signal -92dBm noise antenna 1 5785 MHz 11a ht/20 [|802.11]IP 203.104.153.6.443 > 192.168.1.15.55654: Flags [.], ack 2377, win 370, options [nop,nop,TS val 138304012 ecr 1153910484,nop,nop,sack 2 {34453:47521}{3565:30889}], length 0
   59  15:46:22.266638 2112098232us tsft -92dBm noise antenna 1 5785 MHz 11a ht/20 User 0 MCS 4 LDPC FEC 80 MHz short GI IP 192.168.1.15.55654 > 203.104.153.6.443: Flags [.], seq 55837:57025, ack 0, win 1024, options [nop,nop,TS val 1153910736 ecr 138303987], length 1188
   60  15:46:22.266745 2112098232us tsft -92dBm noise antenna 1 5785 MHz 11a ht/20 User 0 MCS 4 LDPC FEC 80 MHz short GI IP 192.168.1.15.55654 > 203.104.153.6.443: Flags [.], seq 57025:58213, ack 0, win 1024, options [nop,nop,TS val 1153910736 ecr 138303987], length 1188
   61  15:46:22.266821 2112098232us tsft -92dBm noise antenna 1 5785 MHz 11a ht/20 User 0 MCS 4 LDPC FEC 80 MHz short GI IP 192.168.1.15.55654 > 203.104.153.6.443: Flags [.], seq 58213:59401, ack 0, win 1024, options [nop,nop,TS val 1153910736 ecr 138303996], length 1188
   62  15:46:22.266897 2112098232us tsft -35dBm signal -92dBm noise antenna 1 5785 MHz 11a ht/20 [|802.11]IP 192.168.1.15.55654 > 203.104.153.6.443: Flags [.], seq 59401:60589, ack 0, win 1024, options [nop,nop,TS val 1153910736 ecr 138303996], length 1188
   63  15:46:22.267310 2112099203us tsft -92dBm noise antenna 1 5785 MHz 11a ht/20 User 0 MCS 5 LDPC FEC 80 MHz long GI IP 192.168.1.15.55654 > 203.104.153.6.443: Flags [.], seq 60589:61777, ack 0, win 1024, options [nop,nop,TS val 1153910738 ecr 138303999], length 1188
   64  15:46:22.267386 2112099203us tsft -92dBm noise antenna 1 5785 MHz 11a ht/20 User 0 MCS 5 LDPC FEC 80 MHz long GI IP 192.168.1.15.55654 > 203.104.153.6.443: Flags [.], seq 61777:62965, ack 0, win 1024, options [nop,nop,TS val 1153910738 ecr 138303999], length 1188
   65  15:46:22.267460 2112099203us tsft -92dBm noise antenna 1 5785 MHz 11a ht/20 User 0 MCS 5 LDPC FEC 80 MHz long GI IP 192.168.1.15.55654 > 203.104.153.6.443: Flags [.], seq 62965:64153, ack 0, win 1024, options [nop,nop,TS val 1153910738 ecr 138304004], length 1188
   66  15:46:22.267534 2112099203us tsft -92dBm noise antenna 1 5785 MHz 11a ht/20 User 0 MCS 5 LDPC FEC 80 MHz long GI IP 192.168.1.15.55654 > 203.104.153.6.443: Flags [.], seq 64153:65341, ack 0, win 1024, options [nop,nop,TS val 1153910738 ecr 138304008], length 1188
   67  15:46:22.267609 2112099203us tsft -36dBm signal -92dBm noise antenna 1 5785 MHz 11a ht/20 [|802.11]IP 192.168.1.15.55654 > 203.104.153.6.443: Flags [.], seq 65341:66529, ack 0, win 1024, options [nop,nop,TS val 1153910738 ecr 138304012], length 1188
   68  15:46:22.277066 2112108730us tsft -57dBm signal -92dBm noise antenna 1 5785 MHz 11a ht/20 [|802.11]IP 203.104.153.6.443 > 192.168.1.15.55654: Flags [.], ack 2377, win 370, options [nop,nop,TS val 138304024 ecr 1153910484,nop,nop,sack 2 {3565:32077}{34453:47521}], length 0
   69  15:46:22.279900 2112111578us tsft -92dBm noise antenna 1 5785 MHz 11a ht/20 User 0 MCS 5 LDPC FEC 80 MHz long GI IP 192.168.1.15.55654 > 203.104.153.6.443: Flags [.], seq 66529:67717, ack 0, win 1024, options [nop,nop,TS val 1153910749 ecr 138304024], length 1188
   70  15:46:22.279986 2112111578us tsft -36dBm signal -92dBm noise antenna 1 5785 MHz 11a ht/20 [|802.11]IP 192.168.1.15.55654 > 203.104.153.6.443: Flags [.], seq 67717:68905, ack 0, win 1024, options [nop,nop,TS val 1153910749 ecr 138304024], length 1188
   71  15:46:22.313294 2112144915us tsft -92dBm noise antenna 1 5785 MHz 11a ht/20 User 0 MCS 7 LDPC FEC 80 MHz short GI IP 203.104.153.6.443 > 192.168.1.15.55654: Flags [.], ack 2377, win 370, options [nop,nop,TS val 138304028 ecr 1153910484,nop,nop,sack 2 {3565:33265}{34453:47521}], length 0
   72  15:46:22.313400 2112144915us tsft -92dBm noise antenna 1 5785 MHz 11a ht/20 User 0 MCS 7 LDPC FEC 80 MHz short GI IP 203.104.153.6.443 > 192.168.1.15.55654: Flags [.], ack 2377, win 370, options [nop,nop,TS val 138304032 ecr 1153910484,nop,nop,sack 1 {3565:47521}], length 0
   73  15:46:22.313477 2112144915us tsft -57dBm signal -92dBm noise antenna 1 5785 MHz 11a ht/20 [|802.11]IP 203.104.153.6.443 > 192.168.1.15.55654: Flags [.], ack 2377, win 370, options [nop,nop,TS val 138304053 ecr 1153910484,nop,nop,sack 1 {3565:48709}], length 0
   74  15:46:22.368888 2112200542us tsft -92dBm noise antenna 1 5785 MHz 11a ht/20 User 0 MCS 1 LDPC FEC 80 MHz long GI IP 192.168.1.15.55654 > 203.104.153.6.443: Flags [.], seq 68905:70093, ack 0, win 1024, options [nop,nop,TS val 1153910785 ecr 138304028], length 1188
   75  15:46:22.368995 2112200542us tsft -92dBm noise antenna 1 5785 MHz 11a ht/20 User 0 MCS 1 LDPC FEC 80 MHz long GI IP 192.168.1.15.55654 > 203.104.153.6.443: Flags [.], seq 70093:71281, ack 0, win 1024, options [nop,nop,TS val 1153910785 ecr 138304028], length 1188
   76  15:46:22.369070 2112200542us tsft -92dBm noise antenna 1 5785 MHz 11a ht/20 User 0 MCS 1 LDPC FEC 80 MHz long GI IP 192.168.1.15.55654 > 203.104.153.6.443: Flags [.], seq 71281:72469, ack 0, win 1024, options [nop,nop,TS val 1153910785 ecr 138304032], length 1188
   77  15:46:22.369145 2112200542us tsft -92dBm noise antenna 1 5785 MHz 11a ht/20 User 0 MCS 1 LDPC FEC 80 MHz long GI IP 192.168.1.15.55654 > 203.104.153.6.443: Flags [.], seq 72469:73657, ack 0, win 1024, options [nop,nop,TS val 1153910785 ecr 138304032], length 1188
   78  15:46:22.369285 2112200542us tsft -35dBm signal -92dBm noise antenna 1 5785 MHz 11a ht/20 [|802.11]IP 192.168.1.15.55654 > 203.104.153.6.443: Flags [.], seq 73657:74845, ack 0, win 1024, options [nop,nop,TS val 1153910785 ecr 138304053], length 1188
   79  15:46:22.369619 2112201401us tsft -92dBm noise antenna 1 5785 MHz 11a ht/20 User 0 MCS 7 LDPC FEC 80 MHz short GI IP 203.104.153.6.443 > 192.168.1.15.55654: Flags [.], ack 2377, win 370, options [nop,nop,TS val 138304075 ecr 1153910484,nop,nop,sack 1 {3565:49897}], length 0
   80  15:46:22.369695 2112201401us tsft -92dBm noise antenna 1 5785 MHz 11a ht/20 User 0 MCS 7 LDPC FEC 80 MHz short GI IP 203.104.153.6.443 > 192.168.1.15.55654: Flags [.], ack 2377, win 370, options [nop,nop,TS val 138304089 ecr 1153910484,nop,nop,sack 1 {3565:51085}], length 0
   81  15:46:22.369770 2112201401us tsft -56dBm signal -92dBm noise antenna 1 5785 MHz 11a ht/20 [|802.11]IP 203.104.153.6.443 > 192.168.1.15.55654: Flags [.], ack 2377, win 370, options [nop,nop,TS val 138304102 ecr 1153910484,nop,nop,sack 1 {3565:52273}], length 0
   82  15:46:22.371944 2112203732us tsft -57dBm signal -92dBm noise antenna 1 5785 MHz 11a ht/20 [|802.11]IP 203.104.153.6.443 > 192.168.1.15.55654: Flags [.], ack 2377, win 370, options [nop,nop,TS val 138304120 ecr 1153910484,nop,nop,sack 1 {3565:53461}], length 0
   83  15:46:22.417370 2112249188us tsft -56dBm signal -92dBm noise antenna 1 5785 MHz 11a ht/20 [|802.11]IP 203.104.153.6.443 > 192.168.1.15.55654: Flags [.], ack 2377, win 370, options [nop,nop,TS val 138304165 ecr 1153910484,nop,nop,sack 1 {3565:58213}], length 0
   84  15:46:22.423143 2112254848us tsft -54dBm signal -92dBm noise antenna 1 5785 MHz 11a ht/20 [|802.11]IP 130.211.14.80.443 > 192.168.1.14.63881: Flags [.], ack 46, win 1099, options [nop,nop,TS val 1736074589 ecr 2249715474], length 0
   85  15:46:22.570485 2112402096us tsft bad-fcs -57dBm signal -92dBm noise antenna 1 5785 MHz 11a ht/20 [|802.11]IP 203.104.153.6.20783 > 192.168.1.135.35231: Flags [.], ack 4079373440, win 370, options [nop,nop,TS val 138304303 ecr 1153910484,nop,nop,sack 1 {460692278:468064105}], length 0
   86  15:46:23.083871 2112915580us tsft -53dBm signal -92dBm noise antenna 1 5785 MHz 11a ht/20 [|802.11]IP 17.57.145.22.5223 > 192.168.1.13.50652: Flags [P.], seq 4056643074:4056643127, ack 3533285653, win 284, options [nop,nop,TS val 2032933840 ecr 347166290], length 53
   87  15:46:24.170535 2114002272us tsft -92dBm noise antenna 1 5785 MHz 11a ht/20 User 0 MCS 5 LDPC FEC 80 MHz long GI IP 192.168.1.15.55654 > 203.104.153.6.443: Flags [.], seq 76033:77221, ack 0, win 1024, options [nop,nop,TS val 1153912633 ecr 138305812], length 1188
   88  15:46:24.170642 2114002272us tsft -36dBm signal -92dBm noise antenna 1 5785 MHz 11a ht/20 [|802.11]IP 192.168.1.15.55654 > 203.104.153.6.443: Flags [.], seq 77221:78409, ack 0, win 1024, options [nop,nop,TS val 1153912633 ecr 138305812], length 1188
   89  15:46:24.370882 2114202673us tsft -92dBm noise antenna 1 5785 MHz 11a ht/20 User 0 MCS 5 LDPC FEC 80 MHz long GI IP 192.168.1.15.55654 > 203.104.153.6.443: Flags [.], seq 78409:79597, ack 0, win 1024, options [nop,nop,TS val 1153912833 ecr 138306008], length 1188
   90  15:46:24.371054 2114202673us tsft -92dBm noise antenna 1 5785 MHz 11a ht/20 User 0 MCS 5 LDPC FEC 80 MHz long GI IP 192.168.1.15.55654 > 203.104.153.6.443: Flags [.], seq 79597:80785, ack 0, win 1024, options [nop,nop,TS val 1153912833 ecr 138306008], length 1188
   91  15:46:24.371129 2114202673us tsft -92dBm noise antenna 1 5785 MHz 11a ht/20 User 0 MCS 5 LDPC FEC 80 MHz long GI IP 192.168.1.15.55654 > 203.104.153.6.443: Flags [.], seq 80785:81973, ack 0, win 1024, options [nop,nop,TS val 1153912833 ecr 138306027], length 1188
   92  15:46:24.371206 2114202673us tsft -36dBm signal -92dBm noise antenna 1 5785 MHz 11a ht/20 [|802.11]IP 192.168.1.15.55654 > 203.104.153.6.443: Flags [.], seq 81973:83161, ack 0, win 1024, options [nop,nop,TS val 1153912833 ecr 138306027], length 1188
   93  15:46:24.679017 2114510556us tsft bad-fcs -58dBm signal -86dBm noise antenna 1 5785 MHz 11a ht/20 [|802.11]IP 203.104.153.6.2491 > 192.168.1.15.55654: Flags [.], ack 245176173, win 370, options [nop,nop,TS val 138307285 ecr 1153912835], length 0
   94  15:46:24.684101 2114515720us tsft -86dBm noise antenna 1 5785 MHz 11a ht/20 User 0 MCS 5 LDPC FEC 80 MHz long GI IP 192.168.1.15.55654 > 203.104.153.6.443: Flags [.], seq 83161:84349, ack 0, win 1024, options [nop,nop,TS val 1153913145 ecr 138306211], length 1188
   95  15:46:24.684243 2114515720us tsft -86dBm noise antenna 1 5785 MHz 11a ht/20 User 0 MCS 5 LDPC FEC 80 MHz long GI IP 192.168.1.15.55654 > 203.104.153.6.443: Flags [.], seq 84349:85537, ack 0, win 1024, options [nop,nop,TS val 1153913145 ecr 138306211], length 1188
   96  15:46:24.684317 2114515720us tsft -86dBm noise antenna 1 5785 MHz 11a ht/20 User 0 MCS 5 LDPC FEC 80 MHz long GI IP 192.168.1.15.55654 > 203.104.153.6.443: Flags [.], seq 85537:86725, ack 0, win 1024, options [nop,nop,TS val 1153913145 ecr 138306252], length 1188
   97  15:46:24.684392 2114515720us tsft -86dBm noise antenna 1 5785 MHz 11a ht/20 User 0 MCS 5 LDPC FEC 80 MHz long GI IP 192.168.1.15.55654 > 203.104.153.6.443: Flags [.], seq 86725:87913, ack 0, win 1024, options [nop,nop,TS val 1153913145 ecr 138306252], length 1188
   98  15:46:24.684466 2114515720us tsft -86dBm noise antenna 1 5785 MHz 11a ht/20 User 0 MCS 5 LDPC FEC 80 MHz long GI IP 192.168.1.15.55654 > 203.104.153.6.443: Flags [.], seq 87913:89101, ack 0, win 1024, options [nop,nop,TS val 1153913145 ecr 138306261], length 1188
   99  15:46:24.684539 2114515720us tsft -86dBm noise antenna 1 5785 MHz 11a ht/20 User 0 MCS 5 LDPC FEC 80 MHz long GI IP 192.168.1.15.55654 > 203.104.153.6.443: Flags [.], seq 89101:90289, ack 0, win 1024, options [nop,nop,TS val 1153913145 ecr 138306261], length 1188
  100  15:46:24.684615 2114515720us tsft -86dBm noise antenna 1 5785 MHz 11a ht/20 User 0 MCS 5 LDPC FEC 80 MHz long GI IP 192.168.1.15.55654 > 203.104.153.6.443: Flags [.], seq 90289:91477, ack 0, win 1024, options [nop,nop,TS val 1153913145 ecr 138306287], length 1188
  101  15:46:24.684812 2114515720us tsft -36dBm signal -86dBm noise antenna 1 5785 MHz 11a ht/20 [|802.11]IP 192.168.1.15.55654 > 203.104.153.6.443: Flags [.], seq 91477:92665, ack 0, win 1024, options [nop,nop,TS val 1153913145 ecr 138306287], length 1188
  102  15:46:24.780474 2114612159us tsft -58dBm signal -86dBm noise antenna 1 5785 MHz 11a ht/20 [|802.11]IP 203.104.153.6.443 > 192.168.1.15.55654: Flags [.], ack 84349, win 370, options [nop,nop,TS val 138306523 ecr 1153913145], length 0
  103  15:46:24.782033 2114613805us tsft -86dBm noise antenna 1 5785 MHz 11a ht/20 User 0 MCS 7 LDPC FEC 80 MHz short GI IP 203.104.153.6.443 > 192.168.1.15.55654: Flags [.], ack 84349, win 370, options [nop,nop,TS val 138306523 ecr 1153913145], length 0
  104  15:46:24.782118 2114613805us tsft -59dBm signal -86dBm noise antenna 1 5785 MHz 11a ht/20 [|802.11]IP 203.104.153.6.443 > 192.168.1.15.55654: Flags [.], ack 85537, win 370, options [nop,nop,TS val 138306528 ecr 1153913145], length 0
  105  15:46:24.783629 2114615370us tsft -86dBm noise antenna 1 5785 MHz 11a ht/20 User 0 MCS 7 LDPC FEC 80 MHz short GI IP 203.104.153.6.443 > 192.168.1.15.55654: Flags [.], ack 84349, win 370, options [nop,nop,TS val 138306523 ecr 1153913145], length 0
  106  15:46:24.783712 2114615370us tsft -58dBm signal -86dBm noise antenna 1 5785 MHz 11a ht/20 [|802.11]IP 203.104.153.6.443 > 192.168.1.15.55654: Flags [.], ack 85537, win 370, options [nop,nop,TS val 138306528 ecr 1153913145], length 0
  107  15:46:24.785235 2114617034us tsft -86dBm noise antenna 1 5785 MHz 11a ht/20 User 0 MCS 6 LDPC FEC 80 MHz long GI IP 203.104.153.6.443 > 192.168.1.15.55654: Flags [.], ack 84349, win 370, options [nop,nop,TS val 138306523 ecr 1153913145], length 0
  108  15:46:24.785315 2114617034us tsft -55dBm signal -86dBm noise antenna 1 5785 MHz 11a ht/20 [|802.11]IP 203.104.153.6.443 > 192.168.1.15.55654: Flags [.], ack 85537, win 370, options [nop,nop,TS val 138306528 ecr 1153913145], length 0
  109  15:46:24.788589 2114620236us tsft -86dBm noise antenna 1 5785 MHz 11a ht/20 User 0 MCS 9 LDPC FEC 80 MHz long GI IP 192.168.1.15.55654 > 203.104.153.6.443: Flags [.], seq 92665:93853, ack 0, win 1024, options [nop,nop,TS val 1153913249 ecr 138306523], length 1188
  110  15:46:24.788694 2114620236us tsft -86dBm noise antenna 1 5785 MHz 11a ht/20 User 0 MCS 9 LDPC FEC 80 MHz long GI IP 192.168.1.15.55654 > 203.104.153.6.443: Flags [.], seq 93853:95041, ack 0, win 1024, options [nop,nop,TS val 1153913249 ecr 138306523], length 1188
  111  15:46:24.788766 2114620236us tsft -86dBm noise antenna 1 5785 MHz 11a ht/20 User 0 MCS 9 LDPC FEC 80 MHz long GI IP 192.168.1.15.55654 > 203.104.153.6.443: Flags [.], seq 95041:96229, ack 0, win 1024, options [nop,nop,TS val 1153913249 ecr 138306528], length 1188
  112  15:46:24.788839 2114620236us tsft -39dBm signal -86dBm noise antenna 1 5785 MHz 11a ht/20 [|802.11]IP 192.168.1.15.55654 > 203.104.153.6.443: Flags [.], seq 96229:97417, ack 0, win 1024, options [nop,nop,TS val 1153913249 ecr 138306528], length 1188
  113  15:46:24.872553 2114704133us tsft -86dBm noise antenna 1 5785 MHz 11a ht/20 User 0 MCS 5 LDPC FEC 80 MHz long GI IP 192.168.1.11.50831 > 130.211.14.80.443: Flags [P.], seq 282177286:282177352, ack 1004305440, win 1024, options [nop,nop,TS val 1662531567 ecr 723339819], length 66
  114  15:46:24.872688 2114704133us tsft -86dBm noise antenna 1 5785 MHz 11a ht/20 User 0 MCS 5 LDPC FEC 80 MHz long GI IP 192.168.1.11.50831 > 130.211.14.80.443: Flags [.], seq 66:1434, ack 1, win 1024, options [nop,nop,TS val 1662531567 ecr 723339819], length 1368
  115  15:46:24.872763 2114704133us tsft -32dBm signal -86dBm noise antenna 1 5785 MHz 11a ht/20 [|802.11]IP 192.168.1.11.50831 > 130.211.14.80.443: Flags [P.], seq 1434:1724, ack 1, win 1024, options [nop,nop,TS val 1662531567 ecr 723339819], length 290
  116  15:46:24.877751 2114709404us tsft -55dBm signal -86dBm noise antenna 1 5785 MHz 11a ht/20 [|802.11]IP 203.104.153.6.443 > 192.168.1.15.55654: Flags [.], ack 86725, win 370, options [nop,nop,TS val 138306623 ecr 1153913145], length 0
  117  15:46:24.880705 2114712333us tsft -86dBm noise antenna 1 5785 MHz 11a ht/20 User 0 MCS 5 LDPC FEC 80 MHz long GI IP 192.168.1.15.55654 > 203.104.153.6.443: Flags [.], seq 97417:98605, ack 0, win 1024, options [nop,nop,TS val 1153913341 ecr 138306623], length 1188
  118  15:46:24.880811 2114712333us tsft -37dBm signal -86dBm noise antenna 1 5785 MHz 11a ht/20 [|802.11]IP 192.168.1.15.55654 > 203.104.153.6.443: Flags [.], seq 98605:99793, ack 0, win 1024, options [nop,nop,TS val 1153913341 ecr 138306623], length 1188
  119  15:46:24.885031 2114716659us tsft -56dBm signal -86dBm noise antenna 1 5785 MHz 11a ht/20 [|802.11]IP 203.104.153.6.443 > 192.168.1.15.55654: Flags [.], ack 87913, win 370, options [nop,nop,TS val 138306632 ecr 1153913145], length 0
  120  15:46:24.887667 2114719317us tsft bad-fcs -86dBm noise antenna 1 5785 MHz 11a ht/20 User 0 MCS 5 LDPC FEC 80 MHz long GI IP 192.168.1.15.55654 > 203.104.153.6.443: Flags [.], seq 99793:100981, ack 0, win 1024, options [nop,nop,TS val 1153913348 ecr 138306632], length 1188
  121  15:46:24.887741 2114719317us tsft bad-fcs -37dBm signal -86dBm noise antenna 1 5785 MHz 11a ht/20 [|802.11]IP 192.168.1.15.55654 > 203.104.153.6.443: Flags [.], seq 100981:102169, ack 0, win 1024, options [nop,nop,TS val 1153913348 ecr 138306632], length 1188
  122  15:46:24.888019 2114719639us tsft bad-fcs -86dBm noise antenna 1 5785 MHz 11a ht/20 User 0 MCS 5 LDPC FEC 80 MHz long GI IP 192.168.1.15.55654 > 203.104.153.6.443: Flags [.], seq 99793:100981, ack 0, win 1024, options [nop,nop,TS val 1153913348 ecr 138306632], length 1188
  123  15:46:24.888093 2114719639us tsft bad-fcs -37dBm signal -86dBm noise antenna 1 5785 MHz 11a ht/20 [|802.11]IP 192.168.1.15.55654 > 203.104.153.6.443: Flags [.], seq 100981:102169, ack 0, win 1024, options [nop,nop,TS val 1153913348 ecr 138306632], length 1188
  124  15:46:24.888244 2114719798us tsft bad-fcs -37dBm signal -86dBm noise antenna 1 5785 MHz 11a ht/20 [|802.11]IP 192.168.1.15.55654 > 203.104.153.6.443: Flags [.], seq 100981:102169, ack 0, win 1024, options [nop,nop,TS val 1153913348 ecr 138306632], length 1188
  125  15:46:24.888511 2114720145us tsft -37dBm signal -86dBm noise antenna 1 5785 MHz 11a ht/20 [|802.11]IP 192.168.1.15.55654 > 203.104.153.6.443: Flags [.], seq 100981:102169, ack 0, win 1024, options [nop,nop,TS val 1153913348 ecr 138306632], length 1188
  126  15:46:24.888898 2114720572us tsft -36dBm signal -86dBm noise antenna 1 5785 MHz 11a ht/20 [|802.11]IP 192.168.1.15.55654 > 203.104.153.6.443: Flags [.], seq 100981:102169, ack 0, win 1024, options [nop,nop,TS val 1153913348 ecr 138306632], length 1188
  127  15:46:24.928527 2114760137us tsft -86dBm noise antenna 1 5785 MHz 11a ht/20 User 0 MCS 5 LDPC FEC 80 MHz short GI IP 192.168.1.15.55654 > 203.104.153.6.443: Flags [.], seq 102169:103357, ack 0, win 1024, options [nop,nop,TS val 1153913388 ecr 138306645], length 1188
  128  15:46:24.928634 2114760137us tsft -37dBm signal -86dBm noise antenna 1 5785 MHz 11a ht/20 [|802.11]IP 192.168.1.15.55654 > 203.104.153.6.443: Flags [.], seq 103357:104545, ack 0, win 1024, options [nop,nop,TS val 1153913388 ecr 138306645], length 1188
  129  15:46:25.030713 2114862573us tsft -86dBm noise antenna 1 5785 MHz 11a ht/20 User 0 MCS 5 LDPC FEC 80 MHz short GI IP 192.168.1.15.55654 > 203.104.153.6.443: Flags [.], seq 104545:105733, ack 0, win 1024, options [nop,nop,TS val 1153913490 ecr 138306762], length 1188
  130  15:46:25.030822 2114862573us tsft -37dBm signal -86dBm noise antenna 1 5785 MHz 11a ht/20 [|802.11]IP 192.168.1.15.55654 > 203.104.153.6.443: Flags [.], seq 105733:106921, ack 0, win 1024, options [nop,nop,TS val 1153913490 ecr 138306762], length 1188
  131  15:46:25.178659 2115010524us tsft -86dBm noise antenna 1 5785 MHz 11a ht/20 User 0 MCS 1 LDPC FEC 80 MHz long GI IP 192.168.1.15.55654 > 203.104.153.6.443: Flags [.], seq 106921:108109, ack 0, win 1024, options [nop,nop,TS val 1153913608 ecr 138306887], length 1188
  132  15:46:25.178743 2115010524us tsft -36dBm signal -86dBm noise antenna 1 5785 MHz 11a ht/20 [|802.11]IP 192.168.1.15.55654 > 203.104.153.6.443: Flags [.], seq 108109:109297, ack 0, win 1024, options [nop,nop,TS val 1153913608 ecr 138306887], length 1188
  133  15:46:25.280511 2115112260us tsft -59dBm signal -86dBm noise antenna 1 5785 MHz 11a ht/20 [|802.11]IP 203.104.153.6.443 > 192.168.1.15.55654: Flags [.], ack 92665, win 370, options [nop,nop,TS val 138307018 ecr 1153913145], length 0
  134  15:46:25.283493 2115115235us tsft -86dBm noise antenna 1 5785 MHz 11a ht/20 User 0 MCS 5 LDPC FEC 80 MHz short GI IP 192.168.1.15.55654 > 203.104.153.6.443: Flags [.], seq 109297:110485, ack 0, win 1024, options [nop,nop,TS val 1153913742 ecr 138307018], length 1188
  135  15:46:25.283597 2115115235us tsft -37dBm signal -86dBm noise antenna 1 5785 MHz 11a ht/20 [|802.11]IP 192.168.1.15.55654 > 203.104.153.6.443: Flags [.], seq 110485:111673, ack 0, win 1024, options [nop,nop,TS val 1153913742 ecr 138307018], length 1188
  136  15:46:25.340724 2115172544us tsft -60dBm signal -86dBm noise antenna 1 5785 MHz 11a ht/20 [|802.11]IP 203.104.153.6.443 > 192.168.1.15.55654: Flags [.], ack 93853, win 370, options [nop,nop,TS val 138307085 ecr 1153913249], length 0
  137  15:46:25.343934 2115175685us tsft -86dBm noise antenna 1 5785 MHz 11a ht/20 User 0 MCS 5 LDPC FEC 80 MHz short GI IP 192.168.1.15.55654 > 203.104.153.6.443: Flags [.], seq 111673:112861, ack 0, win 1024, options [nop,nop,TS val 1153913802 ecr 138307085], length 1188
  138  15:46:25.344040 2115175685us tsft -37dBm signal -86dBm noise antenna 1 5785 MHz 11a ht/20 [|802.11]IP 192.168.1.15.55654 > 203.104.153.6.443: Flags [.], seq 112861:114049, ack 0, win 1024, options [nop,nop,TS val 1153913802 ecr 138307085], length 1188
  139  15:46:25.381696 2115213527us tsft -63dBm signal -86dBm noise antenna 1 5785 MHz 11a ht/20 [|802.11]IP 203.104.153.6.443 > 192.168.1.15.55654: Flags [.], ack 96229, win 370, options [nop,nop,TS val 138307124 ecr 1153913249], length 0
  140  15:46:25.384877 2115216516us tsft -86dBm noise antenna 1 5785 MHz 11a ht/20 User 0 MCS 5 LDPC FEC 80 MHz short GI IP 192.168.1.15.55654 > 203.104.153.6.443: Flags [.], seq 114049:115237, ack 0, win 1024, options [nop,nop,TS val 1153913842 ecr 138307124], length 1188
  141  15:46:25.384966 2115216516us tsft -86dBm noise antenna 1 5785 MHz 11a ht/20 User 0 MCS 5 LDPC FEC 80 MHz short GI IP 192.168.1.15.55654 > 203.104.153.6.443: Flags [.], seq 115237:116425, ack 0, win 1024, options [nop,nop,TS val 1153913842 ecr 138307124], length 1188
  142  15:46:25.385042 2115216516us tsft -86dBm noise antenna 1 5785 MHz 11a ht/20 User 0 MCS 5 LDPC FEC 80 MHz short GI IP 192.168.1.15.55654 > 203.104.153.6.443: Flags [.], seq 116425:117613, ack 0, win 1024, options [nop,nop,TS val 1153913842 ecr 138307124], length 1188
  143  15:46:25.385118 2115216516us tsft -37dBm signal -86dBm noise antenna 1 5785 MHz 11a ht/20 [|802.11]IP 192.168.1.15.55654 > 203.104.153.6.443: Flags [.], seq 117613:118801, ack 0, win 1024, options [nop,nop,TS val 1153913842 ecr 138307124], length 1188
  144  15:46:25.440684 2115272494us tsft -86dBm noise antenna 1 5785 MHz 11a ht/20 User 0 MCS 5 LDPC FEC 80 MHz short GI IP 192.168.1.15.55654 > 203.104.153.6.443: Flags [.], seq 118801:119989, ack 0, win 1024, options [nop,nop,TS val 1153913897 ecr 138307175], length 1188
  145  15:46:25.440771 2115272494us tsft -37dBm signal -86dBm noise antenna 1 5785 MHz 11a ht/20 [|802.11]IP 192.168.1.15.55654 > 203.104.153.6.443: Flags [.], seq 119989:121177, ack 0, win 1024, options [nop,nop,TS val 1153913897 ecr 138307175], length 1188
  146  15:46:25.498809 2115330648us tsft -86dBm noise antenna 1 5785 MHz 11a ht/20 User 0 MCS 5 LDPC FEC 80 MHz long GI IP 130.211.14.80.443 > 192.168.1.11.50831: Flags [.], ack 66, win 4435, options [nop,nop,TS val 723345330 ecr 1662531567], length 0
  147  15:46:25.498891 2115330648us tsft -86dBm noise antenna 1 5785 MHz 11a ht/20 User 0 MCS 5 LDPC FEC 80 MHz long GI IP 130.211.14.80.443 > 192.168.1.11.50831: Flags [.], ack 1434, win 4430, options [nop,nop,TS val 723345363 ecr 1662531567], length 0
  148  15:46:25.498966 2115330648us tsft -62dBm signal -86dBm noise antenna 1 5785 MHz 11a ht/20 [|802.11]IP 130.211.14.80.443 > 192.168.1.11.50831: Flags [.], ack 1724, win 4431, options [nop,nop,TS val 723345366 ecr 1662531567], length 0
  149  15:46:25.555607 2115387226us tsft -60dBm signal -86dBm noise antenna 1 5785 MHz 11a ht/20 [|802.11]IP 203.104.153.6.443 > 192.168.1.15.55654: Flags [.], ack 99793, win 370, options [nop,nop,TS val 138307300 ecr 1153913341], length 0
  150  15:46:25.590289 2115421924us tsft -86dBm noise antenna 1 5785 MHz 11a ht/20 User 0 MCS 1 LDPC FEC 80 MHz long GI IP 192.168.1.15.55654 > 203.104.153.6.443: Flags [.], seq 121177:122365, ack 0, win 1024, options [nop,nop,TS val 1153914014 ecr 138307300], length 1188
  151  15:46:25.590378 2115421924us tsft -86dBm noise antenna 1 5785 MHz 11a ht/20 User 0 MCS 1 LDPC FEC 80 MHz long GI IP 192.168.1.15.55654 > 203.104.153.6.443: Flags [.], seq 122365:123553, ack 0, win 1024, options [nop,nop,TS val 1153914014 ecr 138307300], length 1188
